video_id,title,likes,channel_title
txHbh2PAeV4,A-Rod Has Hitting Contest with 22-Month-Old Baseball Prodigy,1906,The Tonight Show Starring Jimmy Fallon
dPWg-A9tiRI,Drunk History - Rose Valland Takes On the Nazis,3366,Comedy Central
sgX_StgXGF0,Marvel Studios' Black Panther - Kinetic Energy Film Clip,14796,Marvel Entertainment
8gcUmiOlM1M,Seven Seconds | Official Trailer [HD] | Netflix,2670,Netflix
NuXHriwQB9g,01/24/2018 - Falcon Heavy Test Fire Finally,1185,Dennis Kapatos
AKstzozuLKY,Christina Aguilera Watches Erika Jayne Crush “Fighter” | Lip Sync Battle,1119,Lip Sync Battle
Cs2Xr2b7ako,"STUDIO TOUR 2018! (Makeup collection, camera equipment & more)✨💛🌼",12411,AdelaineMorin
p5HH2UfZ2wE,DOG TRIES TO WAKE UP SLEEPING PIG,2899,Newsflare
NEmFS50lsTw,Skittles ))) Possible Super Bowl Ad – Sandwich,348,SKITTLESbrand
dZWNPEC6SIw,Maisie Williams HEART RATE MONITOR feat. Eddie Redmayne | GAME OF THRONES SEASON 8 'SPOILERS' (!?),3305,BBC Radio 1
P-MQBhBwvgM,"Elton John - His Past, London's Present. A Taste Of The Future.",528,Elton John
6wHZT2t78E4,"D-Generation X and Scott Hall share a Too Sweet moment with The Bálor Club: Raw 25, Jan. 22, 2018",21168,WWE
NOciiz9WK5Y,The Making of Kendrick Lamar's LOVE. With Teddy Walton | Deconstructed,16004,Genius
4MYaA4WEo1Y,Undercover footage from inside secretive Presidents Club Charity Dinner,81,Business Insider UK
lzEctvL0vrg,The Jet Li Maneuver: Beretta Disassembly at Gunpoint,10242,Forgotten Weapons
XKSHDDBAd1w,"Top 5 Plays of the Night | January 23, 2018",1798,NBA
90CCjgX0n20,OUR FAMILY. #MYCALVINS: Kardashian / Jenner,18425,Calvin Klein
oZm_N6aSU0E,Entire Breaking Bad Series in 1 Minute,8669,Esther Bellido
Uh4XJjr53vg,What's In Madison Beer's Bag | Spill It | Refinery29,693,Refinery29
TMfStd3v330,How NOT to sexually harass someone - The Mash Report - BBC Two,558,BBC
6A3cHzFQsqI,The Fall - Kurious Oranj,612,ombremor
mJ-lFt9_uxI,Volcano’s Spectacular Fiery Display Threatens 56K In The Philippines | NBC News,15,NBC News
YNpCXG66_PA,We Share Our Home With 14 Bears | BEAST BUDDIES,795,Barcroft Animals
Cd2Ue_xw1oo,John Varvatos Spring/Summer 2018 Campaign Featuring Nick Jonas #JVxNJ,113,John Varvatos
K9kVsnTQh-g,washing dishes by hand is better than using a dishwasher,260,paul wheaton
vBQOVNuSNvI,Idris Elba thinks the world is ready for a black James Bond,77,Variety
y2l7bhf5fJo,Cat Trapped in Newly Built Staircase || Viralhog,46,ViralHog
RqAFeV8Bosc,"Dana White clarifies McGregor's status as lightweight champ, makes predictions for 2018",776,TSN Tube
8MPbR6Cbwi4,Justin Timberlake - Say Something (Official Video) ft. Chris Stapleton,90123,justintimberlakeVEVO
lfIhBu0TZBs,Moving on from Beme,53591,CaseyNeistat
NSi-MniOTqI,Pantry Essentials | Basics with Babish,18473,Binging with Babish
8ll04Zzw5UM,Lady Gaga - Joanne (Where Do You Think You’re Goin’?) (Piano Version),40955,LadyGagaVEVO
eEDZuFw34YM,What If Your Airplane Door Burst Open Mid-Flight?,16632,AsapSCIENCE
XblV5A1PlDo,Three Days Grace - The Mountain (Official Video),28340,ThreeDaysGraceVEVO
IBHx9uwCy3w,Are Taco Bell's Nacho Fries Worth the Hype?,11524,TheReportOfTheWeek
DJFeaRWJdy8,Sasha Banks Bosses Up While Eating Spicy Wings | Hot Ones,25820,First We Feast
yN7N0P2TxHQ,Thirty Seconds To Mars - Dangerous Night (Audio),23938,ThirtySecondsToMarsVEVO
FwzoDS3zL_4,KFC | Honky Tonk | Smoky Mountain BBQ,306,KFC
fOsphXJvaUE,Lisa Kudrow is Handling Her Son Going to College Very Well,4490,Jimmy Kimmel Live
efve8-mhdVg,Meghan Trainor Left The Four Set Crying After an Intense Run-In with Diddy,5132,The Tonight Show Starring Jimmy Fallon
wDrx1pxh-Po,Metro Boomin Shows Off His Insane Jewelry Collection | GQ,10907,GQ
pjTj-_55WZ8,"Rudimental - These Days feat. Jess Glynne, Macklemore & Dan Caplen [Official Video]",17376,Rudimental
t8a8EFMAuSU,WWE's Vince McMahon announces he will relaunch XFL in 2020 [Press Conference] | ESPN,5428,ESPN
dOv-1NG-YKc,WILL I EVER GET IN ANOTHER RELATIONSHIP? Q&A,53900,Queen Naija
zq0T7ye-Pn4,RuPaul And Stephen Share A Secret Language,4275,The Late Show with Stephen Colbert
PpElRBQ-yGc,Melix Plays: JUMPSTART First Grade | 90s Games,21067,Marzia
x25k_-Katf4,Ugly history: The 1937 Haitian Massacre - Edward Paulino,5535,TED-Ed
t3z_pdr6z8w,I Don't See Color - A Makeup Tutorial | Jackie Aina,89997,Jackie Aina
CZMO9Ud0tOU,The 809 Objects Left on the Moon,7083,Half as Interesting
GM1QDBvzm1Y,Groupon 2018 Super Bowl Commercial | Who Wouldn't,330,Groupon
DD4jmj9AevM,#PepsiHalftime Choreography BTS | Justin Timberlake | Pepsi,293,Pepsi
KtA3Wp8eNgA,Hollywood Stunt Falls in Slow Motion,47801,The Slow Mo Guys
0GQmGOju6CE,THE GHOST IN MY HOUSE - Morgan Adams,44985,Morgan Adams
XIZmIl9SsXk,People Try The New Diet Coke Flavors,8864,BuzzFeedVideo
zsbT6NMUrSk,Judge Aquilina Delivers Powerful Statement Before Sentencing Larry Nassar | TIME,756,TIME
Np0LMwqtOVM,Brad Makes Sous Vide Steak | Kitchen Basics | Bon Appetit,8035,Bon Appétit
Mhzmc7LRIGo,Opposite Twins Swap Lives for a Day!,73103,Niki and Gabi
52L2HML5O1k,"The Last Jedi Novelization to Feature Deleted Scenes, Star Wars Day at Sea, and More!",4422,Star Wars
HvPbH30KWLE,BTS Takes on L.A. | Vogue,129098,Vogue
01AEuxSlIMg,Lexus LS 500 F SPORT / Marvel Studios’ Black Panther Commercial—Full Length,480,LexusVehicles
XT3gEidTKAc,Just a Couple Friends - Acoustic (MUSIC VIDEO),11158,Sugar Pine 7
9r6NI9m_IxM,Elton John - Farewell Yellow Brick Road Tour: The Launch (VR180),2401,EltonJohnVEVO
kDiJh8loTOE,Falcon Heavy and 9 static fires - What you need to know!,5758,Everyday Astronaut
RjujNLl1jyk,How-To: Make a Deadliest Catch Pineapple Bowl with Trap Kitchen,2207,Munchies
qNl4-y6q5rc,Cuomo presses GOP lawmaker on 'immaculate conception' claim,642,CNN
Prnw-NqXSEY,Storm Chasers' Star Joel Taylor Dies at 38 Aboard Cruise Ship,1039,Inside Edition
0ufNmUyf2co,Here are the weirdest bikes I own - Freak Bike Check!,6969,Seth's Bike Hacks
byBCkV_j-As,Introducing #AerieREAL Role Models,18,Aerie
gTRRvvE3HiU,Helping Shane Dawson Get His Attitude Back (RIVERDALE Skit) | Madelaine Petsch,32449,Madelaine Petsch
leHtDz4Mj0M,China BANS Hip Hop From Television,2800,fantano
SS0ebmCqHxs,Don Diablo - People Say ft. Paije | Official Music Video,25000,DonDiablo
oGmIFXfgPM4,Jennifer Lopez & David Dobrik FEAR BOX Challenge | #JLoNOW,7612,AT&T
Q1CFfU2gXHw,Apple HomePod: Everything to know before you buy (Apple Byte),810,CNET
uikOKrrwsfw,This is One of the Smallest Restaurants in New York,16695,Great Big Story
Di4QJUCElgs,Answering Questions I've Avoided...,16647,jessiepaege
Zvg6b6q1s-Y,Patriots vs. Eagles: Super Bowl XXXIX Full Highlights | NFL,5680,NFL
xYb9HeucPf0,Steve Brown Says Attacker Was Laughing Before He Stormed Stage | TMZ,177,TMZ
klGP5rtA76c,Missouri Star Quilt Company Live Stream,945,Missouri Star Quilt Company
S74uFJHI6gM,"56,000 people flee as Philippines volcano spews lava",78,Guardian News
qDI8LnPq3VY,MTB Skills - Technical Climb,2,Geoff Mallinson
y6KYFcta4SE,"1 dead, others injured after Ky. school shooting",9,Newsy
WlN04DM8ol0,ATV attempt to pull out the car ││ Any Rubbish,2,Any rubbish
EQzWr52gCWA,Fusion 360 to 3D Print Parts to Build a Desk,129,Desktop Makes
1e5vRpODASk,Small Stepper Robot Arm Shuffling Sugar Cubes,11,Electron Dust
pkwSoJrVWAY,Paper Programs Tutorial,29,JanPaul123
yKVAhDbSito,BLOOD SUGAR ❤️ PALETTE & LOVE SICK COLLECTION REVEAL | Jeffree Star Cosmetics,140259,jeffreestar
jLCHpZ6B1gU,Jason Aldean - You Make It Easy (Lyric Video),10087,JasonAldeanVEVO
4Uhe7pNqCFo,Running Through Glass in Slow Motion,43792,The Slow Mo Guys
f_jTeuajas0,Andre The Giant Official Trailer (2018) | HBO,3369,HBO
H3mX88_tx3Q,Trump Goes to Davos While Congress Debates Immigration: A Closer Look,13182,Late Night with Seth Meyers
RQUuqbzQVsY,"Liam Payne, Rita Ora - For You (Fifty Shades Freed)",201936,FiftyShadesVEVO
FmE8DwZ6RHk,Crowd boos as Trump calls media 'fake' in Davos,3371,CNN
MjSZs_uOWxg,Peter and His Heckler - Don't Stop Believin' (with Will Ferrell),13227,The Tonight Show Starring Jimmy Fallon
iNT-tPrz4OM,Footage of how Tom Cruise broke his ankle while filming his latest movie - The Graham Norton Show,1055,BBC
gNG0GiSrwas,"Momsplaining with Kristen Bell #KidsPartyGoals, Ep. 2",4605,TheEllenShow
I5qFoctplSU,Best Hands: 2018 Pro Bowl Skills Showdown | NFL Highlights,8780,NFL
CbfnCflL4-E,Annihilation (2018) - The Shimmer Featurette - Paramount Pictures,615,Paramount Pictures
gfmXCAwBkCE,Viola Davis on Melania Trump's Love of How to Get Away with Murder,1593,Jimmy Kimmel Live
IIS1M7m9tw8,I have something to tell you..,22699,Daisy Marquez
AuWwlxym68g,X Ambassadors - JOYFUL,5328,XAmbassadorsVEVO
9vDdx1dba6c,dodie - Secret For The Mad,32755,dodieVEVO
w6rzRBHy1tk,Chloe Grace Moretz on Louis C.K. and the #MeToo movement,153,Variety
akNs04ef_Co,I Read A Letter From My Younger Self,102668,AmazingPhil
pylyPL64uxk,Team LeBron! Best Plays from Every All-Star on the Team | 2018 NBA All-Star Game,3976,NBA
xIbQZpwVweE,My Bachelor Audition Tape // Grace Helbig,11726,Grace Helbig
90uhxbfUfC4,The Hurricane Heist Trailer,100,Trailers Promos Teasers
WB8ozD7l02w,FIFA 18 - FUT Champions Cup Barcelona - Day 1 - Swiss Group Round 3,18682,EA SPORTS FIFA
VFnXRntc9XA,Jack White - Corporation (Audio),5108,JackWhiteVEVO
bYXM3uz1bjM,James Blake - If The Car Beside You Moves Ahead (Official video),4119,JamesBlakeVEVO
nUgMn2ntSh4,Lucie Fink Trains Like A Professional Gymnast | Lucie For Hire | Refinery29,1324,Refinery29
f1xIeTCgoFk,BLACKPINK - INTRO +  ‘마지막처럼 (AS IF IT’S YOUR LAST)’ in 2018 Seoul Music Awards,151858,BLACKPINK
YWVylysTNIA,German Shepherd being a great attack dog,477,Pomegranate Sunshine
OVnxBcS5qWo,The Download - January 2018,13223,Nintendo
jHvSF0njyvc,Judge Rosemarie Aquilina Full Remarks to Larry Nassar | NBC News,1513,NBC News
nlIE1I6DxjI,David Archuleta - Seasons ft. Madilyn Paige (Official Music Video),3169,David Archuleta
gC3Y7SowqwA,Discounted Nutella causes chaos in French supermarkets,64,Guardian News
9flXyzcSfT4,R3HAB x Mike Williams - Lullaby (Official Video),8260,R3HAB
Xx1tK0RyZxs,James Corden Almost Named His Daughter Beyoncé,255,LIVEKellyandRyan
fSutgzDY_I4,The Cured - Official Trailer I HD I IFC Films,638,IFC Films
cOaRPJQXFG4,Sting & Shaggy - Don't Make Me Wait (audio),1594,Interscope Records
N7xjGJwuu6E,"James Corden on hosting Grammys, Carpool Karaoke",120,CBS This Morning
hcfMZ6qjdXM,This Robot Can Walk and Swim — Inside You | ScienceTake,355,The New York Times
tblXEAKO6KA,Tony Rizzo Embarrassed by Dan Le Batard and Joe Thomas - Again,16,The Scam On Demand
FB64ez0kf1c,Megyn Kelly: I Have No Regrets About My Question To Jane Fonda | Megyn Kelly TODAY,2297,TODAY
dQMZLXaa1L8,Artwork Forge,1,Palo Alto Online
nrB7aqfRzyE,Eagles Fan Gets Wrecked by Pole,793,494ta
wtegEB9lvaA,The Aces - Fake Nice,249,Red Bull Records
eHEwkvFFBII,Elise Mertens v Elina Svitolina match highlights (QF) | Australian Open 2018,286,Australian Open TV
IzQwbRdh5Ts,High Fidelity Mixtape Rules,188,marjolijn2
CWAX-tiepMo,RWBY Volume 5: Chapter 14 - Haven's Fate | Rooster Teeth,37505,Rooster Teeth
nDoQqQUa9C8,OH NO! ALL ANTS DEAD?!,26676,AntsCanada
CZ7KRUYQyKE,HE'S GONE....WE CANT BE WITHOUT HIM ANY LONGER 💔😔,107193,The 2x Family
-p2lhxUqMMQ,Cheng I Sao - Pirate Queen - Extra History,10974,Extra Credits
MtJFuT0KFq4,OUR 1 YEAR OLD BABY FINALLY GETS A NAME,9606,MAZELEE
8MfSVTHqNHU,"DeMarcus Cousins Out for Season, Pelicans Defeat Rockets in Clutch! 2017-18 Season",13876,Chris Smoove
QLFRGj-PPNI,Tom Cruise Shows Slow-Mo Footage of How He Broke His Ankle | The Graham Norton Show,20975,The Graham Norton Show
fAWQ7qPsS3Y,Chelsea Handler Took a Break from News and Twitter to Campaign for Women in Politics,1937,The Tonight Show Starring Jimmy Fallon
48-pr5-G6Pw,HAIM - Night So Long (Live At The Greek),6276,HaimVEVO
floMqK_yHf8,[BANGTAN BOMB] 'MIC Drop' Special Stage (BTS focus) @MAMA - BTS (방탄소년단),342655,BANGTANTV
Vfugwq2uoa0,The Ritual | Official Trailer [HD] | Netflix,4981,Netflix
EgUMLjp3H4E,3 Sesame Street Moments | Robot Chicken | Adult Swim,971,Adult Swim UK
JqIkzS2wSz8,Call Me by Your Name' star Timothee Chalamet on the time he embarrassed himself with Saoirse Ronan,3463,Popcorn with Peter Travers
lbFzL-0pEeU,"I Decided to Sleep for 4 Hours a Day, See What Happened",18183,BRIGHT SIDE
Epm5_DSfMn4,The vision for XFL in 2020,241,XFL
bLKd4XXUWUo,Skittles ))) Possible Super Bowl Ad – Floating,333,SKITTLESbrand
wqS9QwOIH3s,Natural Defined Instagram Makeup | Jessica Clements,7066,Jessica Clements
Bx1aWLcUF3A,Ex-US gymnastics doctor sentenced for dozens of sexual assaults,18,ABC News
z7WjD5G5ZuY,"Revlon Live Boldly | Anthem with Ashley Graham, Adwoa Aboah, Imaan Hammam, Raquel Zimmerman | Revlon",114,revlon
mWaY32HWjKE,QB Luke Falk: Need to show you're a fearless player,11,Cleveland Browns
AmZJwThOfzE,This fox being a derp...,6,Dean Anderson
mdyegeGkdL4,Kendrick lamar / U2 / Dave Chappelle  - XXX / DNA Grammy 2018 Performance,4323,SaggyJ
lpkRFHSpvGI,George W. Bush Returns Cold Open - SNL,41789,Saturday Night Live
7YibRBd46oo,James Corden Leads 'Subway Karaoke' During The 2018 GRAMMY Awards,1606,The Late Late Show with James Corden
M3mJkSqZbX4,"Zedd, Maren Morris, Grey - The Middle (Presented by Target)",13309,ZEDDVEVO
pzPtlmzwajA,Jay-Z opens up about fighting for his marriage with Beyonce,5140,CNN
1KG8Qha7uXw,That Mate Who Thinks He's Bigger Than He Is,3178,Third Leg Studios
HysgiQT5_eI,Roger Federer Men's Singles ceremony | Australian Open 2018,7214,Australian Open TV
uLWBWUwIx64,THIS BRA MAKES YOU STRONGER! (Weird As Seen on TV Procucts),17185,Guava Juice
vorkmWa7He8,We Stole Tampons from the Cashier-less Amazon Go Store,54180,Linus Tech Tips
IIyZuKN2j7U,"Cardi B Talks Grammy Nomination, JAY-Z, Engagement at Clive Davis' Pre-Grammy Gala | Billboard",7115,Billboard
KXBYn9cwl7U,Mamma Mia! Here We Go Again - Grammys Spot,512,Universal Pictures
FGI7iaAIN3U,"What $2,000 Will Get You In NYC | Sweet Digs | Refinery29",2107,Refinery29
nUDX6OCXEyc,MY EPIC NEW FISH POND!,7552,Solid Gold Aquatics
NBgNCDF4lG8,U2 - Get Out Of Your Own Way (LIVE From The 60th GRAMMYs ®),3249,U2VEVO
S_HixQBiVH0,"John Legend And Tony Bennett Sing 'New York, New York'",45,CBS
rew7FoGy1Po,Wizards Give Bad Directions,19061,CollegeHumor
ZDk03lHV47Q,Clever Bookshelf  (Holds IPad),4941,Laura Kampf
kZete48ZtsY,Roger Federer 20th Grand Slam Victory Tribute,1297,ATPWorldTour
3Zew8pLSlwQ,"Top 10 Plays of the Night: January 27, 2018",3701,NBA
xJrOUJpCxOE,Dating the Popular Guy | Lele Pons,290654,Lele Pons
CxGUmtRLm5g,Budweiser 2018 Super Bowl Commercial | “Stand By You”,3420,Budweiser
ywcNsJb2v2U,Rescue of a Scared Homeless Dog with a Broken Heart,17726,Howl Of A Dog
woDDGmpV2KE,Who's Performing at the 2018 GRAMMYs?,932,Recording Academy / GRAMMYs
JOwmqPPkjww,A little Dingo running on a bridge over one of the busiest freeways in the U.S!,20725,Hope For Paws - Official Rescue Channel
1mpdJcGj8Qg,"$14,000 GOLD bar vs 60,000 PSI Waterjet - with Cody's Lab",8390,Waterjet Channel
WmQR7X9SdeU,Cardi B wants a Grammy,181,Associated Press
IzbcIFW1qB0,Celebs at Grammys to Wear White Roses in Solidarity with 'Times Up’ Movement,353,Inside Edition
3jcolXvi8IA,"MY HEIGHT & WEIGHT, BLOATING, & NEW EBOOK COMING SOON??",725,Maddie Lymburner
de8K18_G0qk,Ferras - Coming Back Around,1081,FerrasVEVO
U41Pm93Ej2c,Sega Game Gear Commercial Creamed Spinach - Retro Video Game Commercial / Ad,13,VideoGameAds
OG2C2KgtRRU,How Zippers Are Made - Part 2 Adding Teeth to the Zipper Tape,10,UCAN Zippers USA
u2HVB-9lC3U,Hospital fire in South Korea kills at least 41 people,11,Guardian News
rBUjOY12gJA,What Happens To Your Body When You Start Exercising Regularly,5855,Tech Insider
C1fRIyBW4kk,PJ Morton First Began 'Official Music Video',685,pjmorton
lr4MmmWQtZM,Why is it so Easy to be Thin in Japan?,10340,What I've Learned
6OcOO1k-vGE,Bruno Mars and Cardi B - Finesse (LIVE From The 60th GRAMMYs ®),185646,Vevo
0cZLo3AAan4,"DJ Khaled, Rihanna - Wild Thoughts (2018 Live Performance)",42556,Super Netvid
DjbysQgJ64Y,"Hillary Clinton, Cardi B & More Audition for Fire & Fury - 2018 GRAMMYs",34607,The Late Late Show with James Corden
ytsZFYMGl0w,childish gambino grammy awards performance 2018,25233,Shyrynne
u7KZrt_cHH0,UNSANE | Official Trailer | In theaters March 23,2504,Bleecker Street
TdcS2LMQ5Ck,Bruno Mars Wins Record Of The Year | Acceptance Speech | 60th GRAMMYs,8312,Recording Academy / GRAMMYs
tfuZKI4sTp8,"Sen. Kirsten Gillibrand Talks Allegations Against Steve Wynn, Calling For Al Franken To Step Down",723,The View
npojBTA-pcQ,Lady Gaga - Joanne/Million Reasons (LIVE From The 60th GRAMMYs ®),29699,EntertainmentVevo
Ct9BFr9XBaI,Luke Combs - One Number Away,8932,LukeCombsVEVO
6HOO1d3ltA8,Grammys 2018: Hillary Clinton surprises crowd to read Fire and Fury,2723,CBS News
OL4LNg-iyY4,P!nk - Wild Hearts Can't Be Broken (Official Video),24415,PinkVEVO
D-IkMEDaNQY,Cardi B Has Butterflies in Her Stomach & Where?! | E! Live from the Red Carpet,16333,E! Live from the Red Carpet
d2sJNee7FQ4,When We First Met | Official Trailer [HD] | Netflix,9365,Netflix
IBVo8dfqTBc,Rey Mysterio makes a shocking return in the Royal Rumble Match: Royal Rumble 2018 (WWE Network),125915,WWE
S9Xg6iUxYXU,Here’s what you missed at the 2018 Grammy Awards,2941,Washington Post
SEikcs2SbJA,FBI Dep. Director McCabe stepping down,1022,CNN
uAmsViupOa4,Andrew McCabe Steps Down As Deputy Director Of The FBI | Andrea Mitchell | MSNBC,522,MSNBC
7cmzAjwmc5k,Kesha Performs Praying at 2018 Grammys,3787,ET Canada
tfNzMKvoVOU,The problem with online charter schools,10049,Vox
e3UqLAtdZ04,Nicole Kidman Eats Bugs | Secret Talent Theatre | Vanity Fair,651,Vanity Fair
1A_aWbz6D5A,"The BIGGEST Moments From the 2018 Grammys: Kesha, Bruno Mars, Kendrick Lamar, & Hillary Clinton",1419,Entertainment Tonight
i1AHCaokqhg,4-2: The History of Super Mario Bros.' Most Infamous Level,14633,Summoning Salt
kVWj8lgQvsE,Fifth Harmony’s Ally Brooke is Selena AND J-Lo | Lip Sync Battle,3119,Lip Sync Battle
melV2fR6-T0,Best & Worst Dressed Grammys 2018 (Dirty Laundry),7074,Clevver Style
9NkHIv25IH4,Could You Survive In These Extreme Conditions?,13305,Life Noggin
1JXq9779zwU,Why is NASA sending a spacecraft to a metal world? - Linda T. Elkins-Tanton,7354,TED-Ed
KBlmLfHSKFs,Inside the Mind of a Dog,4342,Great Big Story
EMTo2UqcnGg,WWE Royal Rumble 2018 Review: What Went Down?,4327,WhatCulture Wrestling
Ii_Gz1WbBGA,Controlling An Airport From 80 Miles Away,8496,Tom Scott
7xN52zQzYy8,Tom Brady Hangs Up On Boston Radio Hosts After Insult About Daughter | SI Wire | Sports Illustrated,147,Sports Illustrated
q-giH_ezRTE,Kendrick Lamar and Rihanna win Best Rap/Sung Performance at The Grammy Awards 2018,163,RihannaNavyVevo
zPm4rR1cmzU,I THREW MYSELF A GRADUATION CEREMONY,54726,ElleOfTheMills
KIEVOMxKWxc,Off Camera Secrets | Grand Theft Auto V - Boundary Break,9194,Shesez
i7FgneNlM14,WEEI: Alex Reimer calls Tom Brady’s daughter an “Annoying Little Pissant” 1/25/18,258,Nick Ramos
kZLBVi_0ENU,Chris Stapleton - Midnight Train To Memphis (Live From SNL Studios/2018),3263,ChrisStapletonVEVO
li6f_0x0IGE,Meet My BABY GIRL! | Fleur De Force,37375,Fleur DeForce
ZurW-Uc6Lc0,HORMONES | The Weekly #4 | LIFESTYLE,20372,Sprinkleofglitter
HkOLf9BMRZ4,Beauty gadgets of the future,633,The Verge
nb42DxagyOE,Call Me By Your Name': Which fruit would Elio try on the sequels?,997,Movie'n'co UK
l7YnFiAAlxw,"Climbers on scaling Antarctica mountains, spirit of exploration",81,CBS This Morning
Zb0wnYnrMHg,Will it Slice? SLICER 5 000 000 Vs. Frying pan and Paper!,8320,Hydraulic Press Channel
YLPNjaAOrBw,Did Alexa Lose Her Voice? - Teaser - Amazon Super Bowl Commercial LII,763,amazon
4Ek6UCI0YQs,Dan Quayle Speech About Murphy Brown and Family Values,2,Kevin Stein
RkU4WWEUj-Y,Microsoft Bob Experience: Was It Really THAT Bad?,8883,LGR
TTio2AvTMKk,Inside The Littiest Pre-GRAMMY Party!,37,YBF Chic
6ZwXRnueOMg,9 SITUATIONS EVERY CAT OWNER WILL RECOGNIZE,2839,smoothiethecat
sNgByUWwFKU,Falcon Heavy Demo | Static Fire,15065,SpaceX
jQR_Bp66u9w,Half Magic - Official Red Band Trailer,9,Momentum Pictures
8_rTIAOohas,Marvel Studios' Ant-Man and the Wasp - Official Trailer,208937,Marvel Entertainment
_r0cf42EUBw,I Got A Makeover In 3 Different U.S. Cities,122092,Safiya Nygaard
6Nr_xHolP1Q,EVERY ELEVATOR EVER,47519,Smosh
V6wWKNij_1M,Hereditary | Official Trailer HD | A24,6264,A24
tPtMP_NAMz0,Think Fast! with Dakota Johnson,14362,The Tonight Show Starring Jimmy Fallon
upt1wHntDws,Screen Junkies 2017 Oscar Nominations: Our Academy Awards Picks,4977,Screen Junkies
yXLo4iOb3GU,Things I'm Changing About Myself,19122,ConnorFranta
UCKC-QVcVn0,The Engineering of the Drinking Bird,8289,engineerguy
V8-JfSXPDp0,What Does a Giant Monster Neodymium Magnet do to a Mouse?,16995,The Action Lab
l0VNEl2qw2M,Roger Federer press conference (F) | Australian Open 2018,2177,Australian Open TV
ZrhKHytNLqY,Janelle Monae Introduces Kesha With a Powerful Message About the #MeToo Movement,344,Catch-Up TV
db9Shsd8q8M,Childish Gambino Gives SOULFUL Terrified Performance At 2018 Grammys,384,Clevver News
NzCSJrxQyQI,Joel Embiid ROASTS Russell Westbrook For Shooting 33 Times!!,8,DaHoopSpot Productions
_GcsQuOGPPk,I Dyed My Virgin Hair For The First Time | Beauty With Mi | Refinery29,2420,Refinery29
h8VJft5Xq5g,"Flashing Light Prize 2018 - Sunscreen, UV, and neon",2520,Applied Science
7FceZB6qMiA,"Kyrie Irving and Stephen Curry Duel at Oracle | January 27, 2018",2607,NBA
kD3XrTz8G8Q,Chloe Kim wins Women’s Snowboard SuperPipe gold | X Games Aspen 2018,124,X Games
sdKWEWu4PnE,Shinsuke Wins Rumble | Reaction | WWE Royal Rumble,621,lugeyps3
tySwY8qXwbQ,Never Bet Your Money On Another Man's Game,1108,Spinach Dippa
jg4hFf-zmn8,Donkey and Woman Who Both Lost Children Celebrate Their Emotional Journey | The Dodo Party Animals,5243,The Dodo
DQDj074iEuM,LuLaRoe Consultant Mocks Those With Special Needs,27,J S
EY8rq1AyCPY,BITCONNECT EDM REMIX,1432,Dylan Locke
TynRELscK8s,When Your Bunny is a Diva,2246,Bini the Bunny
HEuJgDU68wo,This Is Us 2x14 Promo Super Bowl Sunday (HD),1349,TV Promos
kUZlz6VbMCg,WATCH: The super blue blood moon makes first appearance since 1866,32918,PBS NewsHour
Tz5L-rNWZBs,Stephen Goes Live After Trump's State Of The Union,30286,The Late Show with Stephen Colbert
I3ysRfAo49k,These cops will pull you over for literally anything 🙄🙄🙄,64867,Adam Smith
ATFwMO9CebA,President Trump 2018 State of the Union Address (C-SPAN),7998,C-SPAN
exsOim0Lyl4,President Donald Trump’s State of the Union Address 2018 (Full) | NBC News,17050,NBC News
oaU82_uGTQg,Drop the Mic w/ Helen Mirren,10183,The Late Late Show with James Corden
QWz3auJ78ik,Bebe Rexha - Meant to Be (feat. Florida Georgia Line) [Fan Video],18275,Bebe Rexha
sosxR6ZALjc,Why Wednesday's Super Blue Blood Moon will be a sight to behold,1224,CBS Evening News
0I9vWjc9nao,"My therapist, Dr. Plier",19477,Sugar Pine 7
gYYMnkoFtjM,The First Purge Announcement - In Theaters July 4,6783,Universal Pictures
dgcr3mCsqBE,"Kerry Washington on Scandal, Oprah & State of the Union",1208,Jimmy Kimmel Live
g8GJV08_pRU,"Universal Studios For Celebration Of Harry Potter Expo 2018 | WB Studio Tour, Movie Props & More!",2704,TheTimTracker
HUZRjGEwqCg,State of the Union 2018 live stream: President Donald Trump delivers first SOTU Address | ABC News,2176,ABC News
Hvysy11716g,Why We Pick Difficult Partners,14872,The School of Life
CUnRQYS6xqo,Grammy Awards President: Women Need To Step Up!,4258,fantano
mUSv8b-V5I4,"Here’s Why the 2018 Lincoln Navigator is Worth $100,000",22331,Doug DeMuro
H5tK00zL6EQ,"Hank, I Have Some Advice",13501,vlogbrothers
__1SjDrSMik,maybe i could eat blades of grass,119634,bill wurtz
OitUxz6txUI,"Amazon, Berkshire Hathaway, And J.P. Morgan To Partner On Health Care | CNBC",89,CNBC
r5JK6eEHwIQ,Glee Star Mark Salling Dead of Apparent Suicide | TMZ News,1067,TMZ
4eKYR_iL5eU,DORITOS BLAZE vs. MTN DEW ICE | Super Bowl Commercial with Peter Dinklage and Morgan Freeman,6343,Mountain Dew
nk3a7zq84Co,Game Day Artichoke Dip - You Suck at Cooking (episode 71),21732,You Suck At Cooking
tdfFoSC8_7k,Untangling the Devil's Corkscrew,6524,PBS Eons
lRxAWujpMmA,Darren Criss Talks The Assassination of Gianni Versace,826,Late Night with Seth Meyers
zbtyaKAMDdk,Bullet Racing,72877,The Slow Mo Guys
YGOesyoKLI4,Marcellus Wiley has officially lost it after the Clippers trade Blake Griffin to the Pistons | ESPN,840,ESPN
LnA4DGoihak,"DUNDEE Official Trailer # 2 (2018) Margot Robbie, Hugh Jackman New Comedy Movie HD",2981,ONE Media
-0NYY8cqdiQ,Megan Mullally Didn't Notice the Interesting Pattern with Ellen's Roommates,4429,TheEllenShow
hIFwL6O_6aA,"SPOILER ALERT! 🌹🏁 Krystal, Will You Accept This Ride? | The Bachelor Insider",571,The Bachelor Insider
k0BqqEMobcY,NFC vs. AFC | 2018 NFL Pro Bowl Game Highlights,14639,NFL
SJXXGL_8VcU,Keith Urban - Female Acoustic,1782,Keith Urban
Dc-EG4ABsxA,This is a Handheld Gaming PC,17321,Austin Evans
qfZcxeqa1g4,M&M’S Super Bowl Commercial 2018 (featuring Danny DeVito) – ‘Human’ :30,2178,mmschocolate
GQ6cKZ3Zf9A,How This Frugal Family of 4 Paid Off $96k in Debt & Built a Custom Tiny House,4448,Exploring Alternatives
h8FkbFoRCzc,Do You Need a $350 Rice Cooker? — You Can Do This,1495,Eater
_JVdoEIbKio,Puppy Bowl in Real Life (Way too many puppies),15750,AnthonyPadilla
Q0BIVH-8pwk,Saved By The Max LA Ticket Announcement!,7,Saved By The Max
-V1Oo7srGf0,YOUR DATE IS HERE - Horror Short,4804,Midnight Video
SwEVxk-jWDo,Tour The Brand New Global Headquarters Of Insider Inc.,99,Business Insider
d4KL7vqhpWA,*SPOILER* 1st Eliminated Queen RuPaul's All Stars 3: Behind the Scenes,7472,WOWPresents
jCVkaZChKmc,WET N WILD vs. YSL 💕😍 Foundation Dupe Battle! 🔪 WEAR TEST,9537,Shaaanxo
spUNpyF58BY,But what is the Fourier Transform?  A visual introduction.,21524,3Blue1Brown
Qf24J2Twws4,Troye Sivan My My My! Official Lyrics & Meaning | Verified,16055,Genius
2aThW4BSdbQ,MY PARENTS REACT TO POPPY,12056,SuperwomanVlogs
N7YPLAhjW6g,World's Smallest Working Gamecube Controller,144,Madmorda
