video_id,title,likes,channel_title
3UoKswz6OQc,(SPOILERS) Mid-Season Finale Talked About Scene | The Walking Dead,4681,amc
2QHltvwTjSk,New York City Police Confirm Explosion In Port Authority | CNBC,1104,CNBC
yqulWPljawo,Jimmy Kimmel Returns with Baby Billy After Heart Surgery,29863,Jimmy Kimmel Live
IXJhN4cOVM0,Celebrities rally around bullied boy after he shares emotional story,1396,CBS This Morning
5beh5ztM0K8,Fuller House - Season 3B | Official Trailer [HD] | Netflix,2134,Netflix
-o7zywbiFVI,Celebrity Chef Mario Batali Accused Of Sexual Misconduct | Velshi & Ruhle | MSNBC,350,MSNBC
_JhaVNJb3ag,Heart-Wrenching Video: Starving Polar Bear on Iceless Land | National Geographic,4861,National Geographic
2yCp-Dj5-7c,Does Tiffany Haddish Think NeNe Leakes Is Funny? | RHOA | WWHL,912,Watch What Happens Live with Andy Cohen
N4LQuwSjc34,WATCH: Trump sexual misconduct accusers hold news briefing,625,PBS NewsHour
oKuPJ7zF0_k,Zendaya Talks About Zac Efron's Reaction to Their Onscreen Kiss,982,LIVEKellyandRyan
fO8pPjlFtNw,Trying to Make a Wireless Lavalier Microphone,14194,ElectroBOOM
_ASpoeFRTZ0,What If You Didn't Have Bones?,10418,Life Noggin
8dsf7S5GO1U,Jennifer Hudson Is Christmas' Biggest Fan,1987,TheEllenShow
FO_Ox_dH0M8,How Zero-G Planes Work,11453,Tom Scott
XiIShINrftE,Taylor Swift - ‘Look What You Made Me Do’ (Live At Capital’s Jingle Bell Ball 2017),23436,Capital FM
ii3n7hYQOl4,SPIDER-MAN: INTO THE SPIDER-VERSE - Official Teaser Trailer,127351,Sony Pictures Entertainment
zIiIcjfA2-I,2017 London Chess Classic: Round 9,810,Saint Louis Chess Club
lzuWvKn80V8,If your reflection were honest,16777,AnthonyPadilla
AzLYMcneJMU,Live: New York police responding to reported explosion in Manhattan,257,Washington Post
RiVuoe-jaE0,Mario Batali taken off The Chew amid sexual harassment claims,76,CBS News
TM8hwHtWSJg,REST IN PEACE ANGRY GRANDPA,2918,BeOurGuest
AeB90B9__xM,GoPro Awards: Seagull Theft - With Telemetry in 4K,2504,GoPro
3A-3NaPA3QU,I Tried DIY Skincare For A Week | Beauty With Mi | Refinery29,730,Refinery29
qE7psdp1jVE,CELEBRITY MAKEUP ARTIST DOES MY MAKEUP!,28568,Amber Scholl
30UjfElERlc,Panel Of Women Who Have Accused President Trump Of Misconduct Hold Press Conference | TIME,39,TIME
LTWh-i-iJqM,Star Wars The Last Jedi First Reactions And World Premiere Report - The John Campea Show,3193,John Campea
agOq6iS4aVw,Azealia Banks GOES OFF On Remy Ma For Saying The Female Rap Game Was Nothing Until She Came Home,286,Youtube Tea
Ali918UJSpU,The One Chip Challenge LIVE!!!,5595,ThreadBanger
wJ5bOg46D7Y,CHRISTMAS PAVLOVA MACARONS - The Scran Line,1258,The Scran Line
vfqeeScKVyc,19 CHRISTMAS PARTY OUTFITS: ASOS HAUL AND TRY ON,4194,Inthefrow
cON3fiEm3Lc,We Tried The 2017 Victoria's Secret Model Diet For A Week,5855,Michelle Khare
6P6Ia5Qj9W0,I saw that new star wars,3600,Jenny Nicholson
xp0m08eOD5U,Moby - Like A Motherless Child (Official Video),2094,Moby
o8m2kXgCIMc,Brett Young - O Holy Night,3022,BrettYoungVEVO
exGGotfSuH0,CHRISTMAS PANIC! - Topi the Corgi,1815,Topi The Corgi
ZKUerb6IH4Y,COME CHRISTMAS SHOPPING WITH ME! + GIFT GUIDE | AD,3318,Samantha Maria
23QOy9Q2qNI,Best Videos of the Year 2017 | People Are Awesome,12987,People are Awesome
tRbHXZvVMbM,Apple is reportedly buying Shazam,17,USA TODAY
DUYa7rjRz0s,I Have (a little bit) HAD IT!,12413,vlogbrothers
bo7cX6kCM2A,John Boyega Finn interview - Star Wars The Last Jedi Red Carpet World Premiere,177,Disneyland Experience
j28Gt5_Mlo8,Flying Through a  Sunset Storm || ViralHog,59,ViralHog
1ZqFDsq09H8,Compressed Air Powered Plane,5215,Tom Stanton
tFUKsthR-Ts,Chad and JT Fight for House Parties,5657,Chad Kroeger
kuTBea8_-LY,7 DAYS IN ENTEBBE - Official Trailer [HD] - In Theaters March 2018,1159,Focus Features
r5w4y6GW4U8,Trump's FALSE TEETH Come LOOSE During Speech!,186,Confuse News
9U2kr_QfhoQ,Second-hand cars - transforming old Ford Mustangs into high-end watches,70,Ford Europe
SI1J2bbbOt4,70 People Try 70 Tongue-Twisters From 70 Countries | Condé Nast Traveler,259,Condé Nast Traveler
8oKl_qDJHt4,How to Hijack Amazon Prime Now for Good,25226,Rob Bliss
fOhB5JyEkOQ,Star Wars Cast Takes Which Star Wars Character Are You? Quiz,11396,BuzzFeed Celeb
GSCP2yg-v2g,Everything Wrong With Rogue One: A Star Wars Story,38994,CinemaSins
a7NJ6Gek9v4,ALL TIME GREATEST AIRPLANE SEAT - Emirates First Class Suite,182109,CaseyNeistat
lYEj9snU838,"Boy speaks out on viral bullying video, mom addresses backlash",2306,CBS This Morning
0vKkwJwL77Y,Honest Trailers - Star Wars: Episode VI - Return of the Jedi,23897,Screen Junkies
ZnQGzfrEpsc,Dwayne Johnson Has Exciting Baby News!,23271,TheEllenShow
2GrKY7Qqal8,Matt Damon Explains Why 'Good Will Hunting' Has So Much Cursing,6611,The Late Show with Stephen Colbert
JiOXpKU7tWc,2017 is the Best?,8796,vlogbrothers
8qL4lMQQ9IE,Star Wars: The Last Jedi - Movie Review,25109,Chris Stuckmann
xNvlaa5-vtI,Zendaya's Lip Sync Battle Impersonation Caught Bruno Mars' Attention,20641,The Tonight Show Starring Jimmy Fallon
9OeZYhjyweQ,When Your Uber Driver Takes a Personal Call,11922,CollegeHumor
j7RZy2B73hw,Patriots vs. Dolphins | NFL Week 14 Game Highlights,12586,NFL
YlpXoQEqBWI,10 Ridiculous Tech Gadgets!,16042,Matthias
Y62ExbHI4Yk,What Is The Most Common Crime In Different Countries?,7478,The Infographics Show
h-h5Mhlt6O0,iMac Pro: 1 Week Impressions!,64551,Marques Brownlee
wd8h1iND_ys,My House is Still Burned Down,25481,William Osman
QXcbVHFE2bo,How-To Make Chocolate Mousse with Matty Matheson,9946,Munchies
sukhhtHWgko,Jennifer Hudson: “Burden Down” - The Voice 2017,2448,The Voice
nUnJQWO4YJY,The diet that helps fight climate change,17984,Vox
0DpCDxoj_Xg,Santa Claus Is Comin' To Town' Carpool Karaoke,43217,The Late Late Show with James Corden
MyAnv1nY5Vw,"Keaton Jones, 11: I Hope My Viral Anti-Bullying Video Helps Other Kids | TODAY",312,TODAY
fYo_ZqCFafU,Rooster Teeth and Sean Evans Sample New York City BBQ | Sean in the Wild,7925,First We Feast
rRzxEiBLQCA,TWICE Heart Shaker M/V,754791,jypentertainment
Wl7V4LwkfQE,The Perfect iMac Pro Setup!,9102,Jonathan Morrison
oPM3jxnoqhk,Jennifer Hudson - Burden Down,4580,jenniferhudsonVEVO
ERBEwrn4f7Q,"Kids Interview The 'Star Wars: The Last Jedi' Cast With Daisy Ridley, Mark Hamill & More | PeopleTV",3648,PeopleTV
czX0j3L2ZzQ,NYPD: One Person Injured And In Custody In Midtown Explosion | CNBC,712,CNBC
XsVy4ImgM0o,Have Yourself A Merry Little Christmas (ft. Tori Kelly) - Jacob Collier,4635,Jacob Collier
qxbS8qbBL0c,Ed Sheeran - Perfect in the Live Lounge,5514,BBC Radio 1
WOUZxG1JcGI,What It's Like To Be Absolutely Obsessed With Bitcoin (HBO),3016,VICE News
dx0jvrlV_EQ,The Maccabeats - Candles on the Sill - Hanukkah,1855,MaccabeatsVideos
SbnJwF7GrWg,STAR WARS - REY'S PORTION BREAD - MUG CAKE RECIPE - NERDY NUMMIES,14883,Rosanna Pansino
mSgDg1oiOCs,YouTuber Holiday Gift Wrapping (ft. Eva Gutowski & Kyle Krieger),3684,Tyler Oakley
vZJXXguLysI,The Bachelor Returns Janu-Arie 1,46,Bachelor Nation on ABC
tclPO3kOlfM,Comedian Tig Notaro Says It's A 'Huge Relief' Louis CK Was 'Removed' From Comedy Industry | The View,692,The View
a49beT37Bc0,Keaton Jones Why do they bully? POWERFUL MESSAGE,12857,PHP
bcHh116rcV0,Red Apron | The Cuddle Squad,1111,The Cuddle Squad
6wpb3YfXGqU,MY BEST ADVICE TO MY YOUNG SELF,3522,ilikeweylie
Hfho_nJ5JJ8,Star Wars: Luke's Journey To The Last Jedi,485,ColliderVideos
LRrzLpfdY1g,"Mary, Did You Know? | Anthem Lights",5042,Anthem Lights
ozhENW1LDa8,Alabama senate election: New poll shows Doug Jones ahead of Roy Moore,109,Al Jazeera English
SeVYqisjAQk,Sheryl Crow - The Dreaming Kind (Official Music Video),600,Sherylcrow
fqQ7ymRr5X0,Rudy Mancuso & Maia Mitchell - Sirens (Official Music Video),169711,Rudy Mancuso
zEHRNS-Scrs,How Star Wars was saved in the edit,2001,RocketJump Film School
oFqHvacY9Kk,björk - the gate deconstructed,3294,Björk
eWdZk_88r8I,John Legend And Zara Larsson Perform God Only Knows At Nobel Peace Prize Concert 2017,314,blvck King
givBfOQ47OE,Thoughts While Shopping At Whole Foods,715,Trevor Wallace
Vxww9Ap3DdM,SPORCLE WORLD RECORD - Typing Every Country in Under 3 Minutes,170,Vat19Nvjds
bMfcrZYOAnE,How to Add Headphone Audio Port to Google Home Mini,1177,SnekTek
_rUCjWv0vwA,The Pink Hair Transformation We're Obsessed With | Refinery29,423,Refinery29
wENhHnJI1ys,Map of Biology,2747,Domain of Science
gCwDzQcbiF4,Wild Christmas,1174,Birdbox Studio
s0QeTtDix80,REACTING TO ME IN YOUTUBE REWIND 2017,3091,Just Marcus
3Z6kYVQC83E,A Veitch Christmas Message,9122,James Veitch
89OP78l9oF0,Annihilation (2018) - Official Trailer - Paramount Pictures,15604,Paramount Pictures
pA5NbgdpRpk,"Lavar Ball & Sons On Family Business, Discipline, Donald Trump + More",20132,Breakfast Club Power 105.1 FM
3Sa8G-VR13Q,Joe Biden Speaks With Meghan McCain About His Late Son Beau's Battle With Cancer | The View,5519,The View
JOZzku2SrzQ,I will legally change my name to LitFam,131122,jacksfilms
KdfCcEnJDlY,Amber Explains How Black Women Saved America from Roy Moore,6143,Late Night with Seth Meyers
8I_NkJ8VTEI,Judge Roy Moore Campaign Statement,441,Roy Moore for Senate
vI4LHl4yFuo,Google - Year In Search 2017,38230,Google
Oy9R-z7YTRc,Tom Hanks And Stephen Argue Christmas Tree Technique,6370,The Late Show with Stephen Colbert
s1yurGsRM_s,Anna Camp Takes the Bra Off Her Back for Anna Kendrick,18845,TheEllenShow
XkVwqEdYlNA,The Last Jedi Cast Touches Bearded Dragons & Other Weird Stuff | Fear Box | Vanity Fair,15112,Vanity Fair
Na7VFFnqWVI,Lindsey Stirling - Angels We Have Heard on High,29332,Lindsey Stirling
oQxKEtoHygY,DJ Earworm Mashup - United State of Pop 2017 (How We Do It),8194,Dj Earworm
6FbdqwlR0H4,Bleach Blonde Baby (Official Video),29163,Poppy
IQYLPEuAClo,Harry Styles to the Rescue!,105959,The Late Late Show with James Corden
iKjEoPA0LlY,The Last Jedi Cast Competes in a Compliment Battle | Teen Vogue,11763,Teen Vogue
ZLFak6N04GY,NEW: RECKLESS LOVE (ACOUSTIC VERSION) - Cory Asbury,4183,Bethel Music
KROef3M9gjk,Clean Your Room - Cyanide & Happiness Minis,66812,ExplosmEntertainment
stMM0EsoGwY,HOLIDAY GIFT GUIDE 2017 | Jaclyn Hill,44655,Jaclyn Hill
BLOIU9DpLq4,G-Eazy with Halsey - Him & I,12967,Jimmy Kimmel Live
dedaP9ym-hY,Chris Brown - On Purpose (Audio) ft. AGNEZ MO,26264,ChrisBrownVEVO
66kn6Dcr12E,Taylor Swift's reputation Stadium Tour - Trailer,20671,Taylor Swift
tT-lTxhW7pY,Roy Moore Delivers Concession Speech From Alabama (Full) | NBC News,537,NBC News
hZJDAJDD-uw,T-Mobile CEO John Legere | We're bringing the Un-carrier to TV,1637,T-Mobile
t7Fa1GUf-LE,LightTheWorld LIVE Concert with The Piano Guys and Friends,7312,ThePianoGuys
tUBLW5bCqfM,Peanuts (Riverdale Parody),46995,The Tonight Show Starring Jimmy Fallon
3j5eGupDWY4,"Homeless and abused, this Pit Bull didn't lose HOPE that something amazing will happen!",20347,Hope For Paws - Official Rescue Channel
KjHan6D3O3g,Sam Smith - Have Yourself A Merry Little Christmas in the Live Lounge,1740,BBCRadio1VEVO
IC_lnyn2R2Q,THE 15:17 TO PARIS - Official Trailer [HD],3116,Warner Bros. Pictures
BWJY1na9qao,SURPRISED HER WITH THIS....,7607,Carly and Erin
DkXD5949qqQ,You Make It Feel Like Christmas (Live From “Gwen Stefani’s You Make It Feel Like Christ...,2115,GwenStefaniVEVO
PKa01AvSATE,WATCH: AL Democratic Senate candidate Doug Jones speaks on election night,783,PBS NewsHour
kzFHjyysXr0,Embarrassing Vision Boards From Our Past (ft. Jenna Dewan Tatum),77731,IISuperwomanII
AYte8ks2KAk,Rosenstein speaks before the House Judiciary Committee,142,Washington Post
yArprk0q9eE,This Particle Breaks Time Symmetry,43101,Veritasium
CSDHM6iuogI,Crew Capsule 2.0 First Flight,1576,Blue Origin
1w9tf3vSuVs,"Chit Chat GRWM | Failure, Disappointment & Holidays",3129,Shameless Maya
K4STcvndzbE,Christmas Inheritance | Official Trailer [HD] | Netflix,989,Netflix
-QxZv_wJ1aA,Meet the Dog Protecting Planes From Bird Strikes,5112,Great Big Story
r4ppTbMcFTo,Luke Combs - One Number Away (Lyric Video),1237,LukeCombsVEVO
Jq_98dJuIck,Star Wars: The Last Jedi Review (SPOILER FREE),11191,IGN
Dm9iTlsaie4,Thunder officially on the clock | The Jump | ESPN,1598,ESPN
wtTmLBfIiG4,The Legend of Zelda: Breath of the Wild Expansion Pass - The Champions’ Ballad Trailer,5059,Nintendo
kZ3xRQOhpQI,How Money Is Made | How Stuff Is Made | Refinery29,362,Refinery29
kz1xzBYppW8,Heartbreaking video of schoolboy Keaton Jones recounting being bullied,9988,Guardian News
31Fbv9qRV7s,my wife telling me about her weird dream,3950,austinmcconnell
Gjs1QSa9fpI,Testing BLADE VORTEX Interactions with Devin Supertramp,4235,JerryRigEverything
NvG1FTafzAw,Makeup Bag Lets You See All Your Products,673,INSIDER
hphLiGW6FgE,Wonder Woman' Director Patty Jenkins on Picking The Right Project | Close Up With THR,388,The Hollywood Reporter
sMEmj80EJy8,Simple Makeup GRWM x Q&A,1244,LaMadelynn
32YGGYaUTgE,Fighting California's Wildfires: Stunning Footage from the Front Lines,141,The Atlantic
8J2q99ApzGs,Stranger Things Actor Reveals MAJOR Hint About Season 3,2665,Clevver News
1UPJ_Uk9s5c,Black Panther: New International Trailer Released - Movie Talk,1795,ColliderVideos
VWFoCcbXqAw,Greg talks with  the school shooter who killed his son 25 years ago | StoryCorps,667,StoryCorps
ZeGNvhAsUW8,Ellie Goulding - O Holy Night (Audio),9366,EllieGouldingVEVO
UPPkvPe5WJ8,Star Wars: The Last Jedi Review,2347,John Campea
dkD1l8iKedE,Live Q&A!,2833,Merrell Twins Live
RBpLVXNN6i0,Interlude III - original song | Tessa Violet,8333,Tessa Violet
wCMHJ8bbTQs,hooded tops with special powers,348,Davey Swatpaz
lJkXbzQPIkM,WHAT'S THE BEST HOLIDAY GIFT?/ GABY & ALLISON,3882,Just Between Us
hMBxriQamIU,All Tritones Song (the devil's interval),14478,Rob Scallon
1iUgR_lKn1c,How Trump Became a Cheerleader for Roy Moore | Alabama's Election,91,The New York Times
w1zwGLBpULs,"Interview with Clarice Lispector - São Paulo, 1977 (English subtitles)",552,Penguin Books UK
1emNguW5xAA,Explaining this Complicated Earlobe Repair,1104,Dr. Sandra Lee (aka Dr. Pimple Popper)
Z7GkGeZrb2Y,Make your own crude Cocktail Machine,9582,GreatScott!
EtfIzNdt9Ac,YOUTUBERS REACT TO INVISIBLE BOX CHALLENGE,24999,FBE
8d_202l55LU,The FCC repeals its net neutrality rules,4870,Washington Post
hu_4yAZVNsU,Kevin Hart Lives His Truth And Opens Up About Being Irresponsible And More,17019,Breakfast Club Power 105.1 FM
xLkHEZTSeoU,Casey Neistat Melts His Face Off While Eating Spicy Wings | Hot Ones,88825,First We Feast
Oapebl0bADA,Khalid - Saved (Official Video),41255,KhalidVEVO
6xe64i_4GhM,Controversial WH adviser speaks out on resignation,605,ABC News
wzKL-bQKcgA,Anitta & J Balvin - Downtown (Official Lyric Video) ft. Lele Pons & Juanpa Zurita,405372,Lele Pons
lV3eV9w0h0U,DIY Giant Human Snow Globe!!! - Man Vs Madness,31244,ThreadBanger
h_67XloYXTc,Will Smith Watched His Sons Jump Out of an Airplane,13739,TheEllenShow
ZLgE9FBOtTY,We Demand $1 Fries on the New McDonald's Dollar Menu,8780,Good Mythical Morning
0EbFotkXOiA,Omarosa Manigault Talks White House Exit | The View,1784,The View
0b6l7MIaGdA,"No Moore! | December 13, 2017 Act 1 | Full Frontal on TBS",7525,Full Frontal with Samantha Bee
MvIwx0JThsk,Taylor Swift - …Ready For It? (BloodPop® Remix)(Lyric Video),115338,TaylorSwiftVEVO
oD9XpUKD7y4,ARCADE Game On Your Watch? | 10 Strange Amazon Products,18475,Matthias
DbF91ZtpGGc,Pie - Cyanide & Happiness Shorts,51736,ExplosmEntertainment
NVe6fC4Af-w,Man Gives Drowning Puppy CPR | The Dodo,15413,The Dodo
BHuH-vySEMA,The Late Show 'Rescue Dog Rescue' With Nick Jonas,2097,The Late Show with Stephen Colbert
ChF_ypmiIs8,Keith Urban - Female (Lyric Video),2520,KeithUrbanVEVO
dRvKm__GrqU,EVERY DAY Official Trailer (2018),586,Orion Pictures
NsUQU3r2nsM,Ayrton Little Was ACCEPTED INTO HARVARD UNIVERSITY AT 16 YEARS OLD!,2935,ChangeofplanZ
sD_31GJmhUc,Music of Splatoon 2 BTS - Nintendo Switch,10357,Nintendo
6ZJghIk7_VA,Mannequin Skywalker’s ride to space onboard Crew Capsule 2.0,1357,Blue Origin
arv7U6cfD40,the life-changing magic of tidying up,8186,Anna Akana
jehMXPadHS0,Star Wars: The Last Jedi Cast Play WOULD YOU RATHER? | MTV Movies,3552,MTV International
NeH_wFJ8lZc,Alison Brie's GLOW Co-Stars Freaked Out Over Her Golden Globe Nomination,1384,The Tonight Show Starring Jimmy Fallon
TOdGYZ20oSc,I made him fabulous! | Best Friend Makeover Challenge with boyinaband,31198,Glam&Gore
Y0D0s9eIKuw,Mixing All My Tea Together *warning: some tea was spilled*,60582,Simply Not Logical
adz_lnvL0qI,Tamar's Executive Decision | Tamar & Vince | WE tv,183,WE tv
bAHAwesTLB4,THE MIRACLE SEASON | Official Trailer,97,LD Entertainment
YfOHh5mt9SM,i have a condition that makes me feel like i'm dreaming all the time,35845,doddlevloggle
hXz4LdA-BRI,Netflix Is Trolling Its Viewers And We Love It - SJU,1458,ScreenJunkies News
_CZHqpIpN4k,"The Last Jedi Cast Answers YOUR Questions, Behind the Scenes of the Red Carpet Live Stream, & More!",5426,Star Wars
FY8T06A-j_c,"Top 10 Plays of the Night: December 13, 2017",2639,NBA
DIM6F38ITsY,THE WORLD'S HARDEST SCOOTER TRICK!,3374,Ryan Williams
IMzf3C34NNM,"This Man Has Comforted Over 1,200 Newborns",2972,Great Big Story
OkvNxYMyips,Disney Officially to Buy 21st Century Fox for $52.4 Billion - IGN News,503,IGN News
POcPgCMwYGE,"Best Mic'd Up Sounds of Week 14, 2017 | Sound FX | NFL Films",1553,NFL
wwX-RSqxEXc,17 of 2017: The Year in Pop Culture (ft. Damon and Jo) | Kingsley,2168,Kingsley
ui05f6CoIxA,WINTER NIGHTTIME ROUTINE W RIVERDALE COSTAR VANESSA MORGAN | Madelaine Petsch,15507,Madelaine Petsch
Alt2HGrsfnw,Do You Need a Dedicated Avocado Slicer? — You Can Do This!,548,Eater
ZOBvRs4btvE,Ed Sheeran & Anne-Marie - Fairytale Of New York in the Live Lounge,27133,BBC Radio 1
0bSE-rh7jFg,When the girl you're wrestling has a tough little brother  - 979280,465,RM Videos
lw_KFCgcvA4,3 EVERYDAY LOOKS | Samantha Maria,3561,Samantha Maria
RQREeUE9eGI,17+ MOMENTS WE’RE LEAVING BEHIND IN 2017 (ft. Kingsley) | Collabmas Day 1,2436,DamonAndJo
3fArI2PZBUo,Corgi Snowplow,1046,Rainer Hilland
9FVkXIj-wLQ,WEARING KIM KARDASHIAN'S HAIR FOR A DAY!,24962,Amber Scholl
1PhdQdJjDZc,Predators' Subban scores fluttering goal after turnover by Canucks' Del Zotto,55,SPORTSNET
7l2NnC0MNt4,"Riverdale' S2E09 'Silent Night, Deadly Night' PRESHOW | Sweetwater Secrets",1063,Entertainment Tonight
So_guHTJ4Ng,Matt Damon and the Hemsworth Brothers Run into Ryan,83,LIVEKellyandRyan
GpekGi00XCE,LOOKBOOK | Christmas & New Year's Eve | Hannah Witton,3157,Hannah Witton
B7B6x2bHcUs,"Get to know Doug Jones, Alabama's newest Senator",38,Newsy
DrY4EUirqgE,Jaguar vs. Caiman | Big Cat Week,545,Nat Geo WILD
eiDiKwbGfIY,Ed Sheeran - Perfect Symphony (with Andrea Bocelli),532876,Ed Sheeran
OPHbqY9LHCs,CRS-13 Hosted Webcast,13689,SpaceX
noUH5aYUBx4,FCC Votes to Repeal Net Neutrality; Omarosa Drama Continues: A Closer Look,23285,Late Night with Seth Meyers
TZSVf-yD7N8,"Crosswalk the Musical on Broadway (w/ Hugh Jackman, Zendaya & Zac Efron)",61950,The Late Late Show with James Corden
K-yazBBF3gE,Popcorn Rice,45961,JunsKitchen
Wpr2WvQn-kg,Adam Driver And Stephen Act Out A 'Star Wars' Scene Using Dolls,7218,The Late Show with Stephen Colbert
T7H7uH2t854,RECREATING OUR FAVORITE VINES!,20034,SUPERFRUIT
p2P5jrcNwY4,Stephen A. speculates what LeBron James told Lonzo Ball after Lakers-Cavaliers | First Take | ESPN,4141,ESPN
9mwM1VB9qs0,Will Smith Asks Strangers for Money,4870,Jimmy Kimmel Live
GIRJck1pVRA,Florida Man Stole Kevin Hart's Attention at the NYC Marathon,4662,The Tonight Show Starring Jimmy Fallon
D7sj7L1uLiw,4 Ton Wrecking Ball in Slow Motion - The Slow Mo Guys,90783,The Slow Mo Guys
prmQgSpV3fA,BLACK THOUGHT FREESTYLES ON FLEX | #FREESTYLE087,35596,HOT 97
QRis1pHOhj4,Kate Hudson Briefly Dated A 6-Foot-9 Celibate Football Player  - CONAN on TBS,594,Team Coco
t0N7Vv7bafU,Kid Hilariously Steals Baby Jesus From Manger During Live Nativity Scene,1486,Inside Edition
oxd0unpN_Hw,Kane Brown - Setting the Night On Fire,4232,KaneBrownVEVO
-RUbNqpwOt8,John Cena Answers the Web's Most Searched Questions | WIRED,36287,WIRED
ZWGh7si0Y50,The Polka King | Official Trailer [HD] | Netflix,1500,Netflix
c835XURBeLQ,Giving my 13 year old niece the 'emo phase',8696,Tom Harlock
CHXD9k19q1Y,dodie - In The Middle,47826,dodieVEVO
ZTwOsL-pVzU,5 Days Of Hygge | Try Living With Lucie | Refinery29,2069,Refinery29
JVHFMBfG-cM,Big Bang Recap - The Celebration Reverberation || Mayim Bialik,1123,Mayim Bialik
n4GynhABYdU,SWEET TOFU | 2 Easy Recipes,15232,Marzia
dR10LRByhRc,99 CENT HOLIDAY SHOPPING ADVENTURE!,12290,Amber Scholl
oiAe-vck-sc,GOING TO DISNEYLAND FOR MY FIRST TIME | Madelaine Petsch,8261,Madelaine Petsch
AenmqoozqoA,David Guetta & Afrojack ft Charli XCX & French Montana - Dirty Sexy Money (Official Video),37232,David Guetta
TDqjoaURNOQ,I Trained Like Rey From Star Wars For A Month ⚔️,2548,Michelle Khare
hiGqKwy4yM0,Charli XCX - Backseat (feat. Carly Rae Jepsen) [Official Audio],3385,officialcharlixcx
QzQpsHScgHs,Dark Colors Room Makeover | Mr. Kate,11389,Mr. Kate
tymvJ8wowG4,BROOKS GUESSES MAKEUP PRICES // Grace Helbig,6444,Grace Helbig
6kLYXbNZWRs,Meet Teen Vogue's 2017 21 Under 21 | Teen Vogue,686,Teen Vogue
bw_ob5GFi6I,Ciara - Santa Baby (Taraji's White Hot Holidays 2017),136,cicigoodies2011
IjFxx9SrOTU,Welcome to Winter PUNderland,766,Kyle Gunderson
XXXqaYls50o,Riverdale | Chapter Twenty-Three: The Blackboard Jungle Trailer | The CW,1106,The CW Television Network
37z3bfXu3BA,Portugal. The Man - Cheer Up (from Bright: The Album) [Official Audio],1656,Portugal. The Man
eZFvbili87g,The Greatest Showman | Rewrite The Stars ft. Zendaya | 20th Century FOX,6461,20th Century Fox
HJqALBKE4r4,Christmas Jumper Cake How-To | Cupcake Jemma,2645,CupcakeJemma
Id2hMkmcIMA,Ascend Thailand’s Temple of the Rising Dragon,1868,Great Big Story
P4VipvC54W4,coin cell challenge,6,Michael Rigsby
-W6v2_0evUU,Why this elbow is a TIME person of the year,18077,Vox
szTpLSf9QhY,Animating and junk,2835,Katzun
sVfTvLm-7Ac,HIGHLIGHTS: MK Dons U18s 1-0 Cardiff City U18s,26,MK Dons
dI5IxmA19jw,OPTICAL ILLUSION: Jaw-dropping Diamonds,62,greeenpro
OdJh_Q5XY4U,"MAYWEATHER REVEALS COMEBACK OFFER, FIGHTING IN UFC; POPPIN MAD SH*T: THERE'S ONLY ONE GOAT...ME",2254,FightHype.com
iCXQwI2Luw8,“Santa Baby” ft. Ciara | TARAJI’S WHITE HOT HOLIDAYS,585,Empire
F4Q3kWZ369A,Welcome to the Official Class of 2018 Inductees,189,Rock & Roll Hall of Fame
MYmQlBpF5e0,UK vs JAPAN School Lunches! with Dan and Phil,128340,AmazingPhil
skFCPu6elew,WOODY WOODPECKER Trailer #1 NEW (2018) Live Action Comedy Movie HD,185,MovieAccessTrailers
JuUi12XbalE,"How a $4,550 Bespoke Bicycle is Made",391,Bloomberg
SqyPQ5eAgCY,Pinarello Nytro e-bike: first ride review,64,CyclingTips
OmM425PFd3Y,How Noah Galvin Makes Evan Hansen His Own,20,BUILD Series
2vQ_fnlvvr8,The Smithereens - Blue Period,287,misleadingsilhouette
b9lb2x_OHOk,Guess The Voice - Animation Challenge With Brian Hull,6761,itsAlexClark
Dc6ZDo9ViNA,Clarice Probes Hannibal Lecter About Trump's Russia Ties,10117,The Late Show with Stephen Colbert
EajOkkJ80uc,Ruby Rose Bought Her Mom a Giant Killer Pig,3973,The Tonight Show Starring Jimmy Fallon
gG_XI2jXMKs,My skincare routine,12727,TheReportOfTheWeek
2fJIRQJ39eA,"Chris Brown , Cardi B , Lil Kim , Remy Ma , Yo Gotti Live Hot 97 Hot For The Holidays Concert 2017",441,Zach Simmons
h_-JFUci0BM,Eminem - Love The Way You Lie ft Skylar Grey on Radio 1,6456,BBC Radio 1
fZYtg2BTWBI,Star Wars: The Last Jedi Will Have a MASSIVE Opening Weekend - SJU,1214,ScreenJunkies News
_odvYvbW9VM,REAL CHICAGO DEEP DISH PIZZA = Pizza of Heaven!?,9163,JOLLY
PitE6FVIjgs,"James Harden and Chris Paul Each Score 28 Pts in Win vs. Spurs | December 15, 2017",590,NBA
qVYwqepVCY0,Star Wars The Last Jedi - Which Audience Score Should We Believe?,1457,John Campea
BR7AnZ3S8u8,A Federal Judge In Philadelphia Blocks President Trump's Birth Control Restrictions | TIME,108,TIME
X9QiHlEC22U,The Last Jedi SPOILER PARTY Don't Watch,4023,Jenny Nicholson
dmtTnGlTUI0,Anne-Marie - Then [Official Audio],12607,IAmAnneMarie
cZxOvNxbi7U,Annie Leibovitz Teaches Photography | Official Trailer,1025,MasterClass
DWG2mSSBi8U,Do You Want to Hear a Woke Eminem? | Everyday Struggle,4019,Complex
IbmvDn6I6sI,Operation Redwing - Kickapoo 35735,26,Lawrence Livermore National Laboratory
KKwmGuQaMfo,EPIC DIY Gingerbread House for Cats!,9706,Cole and Marmalade
IR8k4uYnTfI,Hacking PIN Codes with a 3D Printer - Hak5 2314,295,Hak5
-t5YLGn3VHQ,PLAYERUNKNOWN'S BATTLEGROUNDS Xbox Action Trailer,2465,Xbox
hOulcmOHCIQ,White House Tree Trimming Cold Open - SNL,27542,Saturday Night Live
v9wbMzkVseE,Patriots vs. Steelers | NFL Week 15 Game Highlights,9213,NFL
FnAx2bLICOo,5-a-side Scissor Kick,8100,Freddie Lister
JcdLF6XQ0iw,PANCAKE ART CHALLENGE 4!!! Learn How To Make Mario Odyssey Star Wars Jedi Nintendo Food DIY Pancake,578219,Collins Key
1Znl8OUBa_o,Gucci Gang Country Edition! (Dear Ryan),243539,nigahiga
SO0HTI8QuQU,Buying People Presents That Are Really For Yourself,3259,Third Leg Studios
GjDK_6NtYGQ,50 TOTALLY CRAZY IDEAS YOU CAN ACTUALLY DIY,35670,5-Minute Crafts
I-xZz2OabW0,Robert Mueller obtains Trump transition emails,3582,CNN
4vZJn6r0dRw,YOUTUBERS REACT TO TOP 10 VEVO CHANNELS OF ALL TIME,39735,FBE
tBnIH8xPyZA,"What $2,500 Will Get You In NYC | Sweet Digs Home Tour | Refinery29",1472,Refinery29
8bXF29AeVQc,Jack Black | This Week on GMM,5131,Good Mythical Morning
D0N3qaqXymY,Steelers Robbed By NFL Of Win Over Patriots,172,Blurred Culture
gy_aLyB41wQ,"I Bought a Bitcoin on Craigslist for $17,300",22227,TechSmartt
1iGBHh1q0Kg,Man Rescues Raccoon Choking From Car Tarp | The Dodo,9939,The Dodo
W-KEuvd3S-Q,Introducing Communist Amazon Echo,44454,grandayy
r1x0X5PCYak,EXTREME HOLIDAY GLAM TRANSFORMATION!,166116,NikkieTutorials
0IC3II1i5yM,When Harry met Barack: Prince interviews former US president,806,The Royal Family Channel
AEAHRq62p3Q,Steelers' Jesse James late 4th quarter TD overruled! was it the right call?,66,NFL World
2--Pg-y3xNk,Is Andy Cohen Or Anderson Cooper More Kinky In Bed? | WWHL,180,Watch What Happens Live with Andy Cohen
25Uouf_9DUk,Controversial incomplete pass by Jesse James Steelers vs Patriots,22,Sport Hub
