video_id,title,likes,channel_title
2kyS6SvSYSE,WE WANT TO TALK ABOUT OUR MARRIAGE,57527,CaseyNeistat
1ZAPwfrtAFY,The Trump Presidency: Last Week Tonight with John Oliver (HBO),97185,LastWeekTonight
5qpjK5DgCt4,"Racist Superman | Rudy Mancuso, King Bach & Lele Pons",146033,Rudy Mancuso
puqaWrEC7tY,Nickelback Lyrics: Real or Fake?,10172,Good Mythical Morning
d380meD0W0M,I Dare You: GOING BALD!?,132235,nigahiga
gHZ1Qz0KiKM,2 Weeks with iPhone X,9763,iJustine
39idVpFF7NQ,Roy Moore & Jeff Sessions Cold Open - SNL,15993,Saturday Night Live
nc99ccSXST0,5 Ice Cream Gadgets put to the Test,23663,CrazyRussianHacker
jr9QtXwC9vc,The Greatest Showman | Official Trailer 2 [HD] | 20th Century FOX,3543,20th Century Fox
TUmyygCMMGA,Why the rise of the robots won’t mean the end of work,12654,Vox
9wRQljFNDW8,Dion Lewis' 103-Yd Kick Return TD vs. Denver! | Can't-Miss Play | NFL Wk 10 Highlights,655,NFL
VifQlJit6A0,(SPOILERS) 'Shiva Saves the Day' Talked About Scene Ep. 804 | The Walking Dead,1576,amc
5E4ZBSInqUU,Marshmello - Blocks (Official Music Video),114188,marshmello
GgVmn66oK_A,Which Countries Are About To Collapse?,7848,NowThis World
TaTleo4cOs8,SHOPPING FOR NEW FISH!!!,7473,The king of DIY
ZAQs-ctOqXQ,One Change That Would Make Pacific Rim a Classic,8011,Cracked
YVfyYrEmzgM,How does your body know you're full? - Hilary Coller,5398,TED-Ed
eNSN6qet1kE,HomeMade Electric Airplane,11963,PeterSripol
B5HORANmzHw,Founding An Inbreeding-Free Space Colony,8421,SciShow
vU14JY3x81A,How Can You Control Your Dreams?,9586,Life Noggin
6VhU_T463sU,The Making of Hela's Headdress from Thor: Ragnarok,3585,Tested
_-aDHxoblr4,Is It Dangerous To Talk To A Camera While Driving?,11758,Tom Scott
JBZTZZAcFTw,"What $4,800 Will Get You In NYC | Sweet Digs Home Tour | Refinery29",1707,Refinery29
lZ68j2J_GOM,Using Other People's Showers,4884,Gus Johnson
fcVjitaM3LY,78557 and Proth Primes - Numberphile,4687,Numberphile
qeWvgZLz9yU,A Smart... MUG?! - Take apart a Heated Thermos!,9033,JerryRigEverything
iIxy3JN3-jc,LeBron James admits he was ripping Phil Jackson and thinks DeShaun Watson should be the Browns qu...,156,Cleveland Cavaliers on cleveland.com
U0hAC8O7RoI,"I TOOK THE $3,000,000 LAMBO TO CARMAX! They offered me......",4035,hp_overload
CBVGjS_EJok,Amazon Christmas Advert 2017 - Toys & Games,119,Amazon.co.uk
hz7ukDjuq4w,What's Inside a Detectives Car?,3781,officer401
p2hJxyF7mok,New Emirates First Class Suite | Boeing 777 | Emirates,1661,Emirates
Om_zGhJLZ5U,TL;DW - Every DCEU Movie Before Justice League,7515,Screen Junkies
e_7zHm7GsYc,Hunter Hayes - You Should Be Loved (Part One Of Pictures),1318,Hunter Hayes
dQvIbulWCM4,Celebrities on Thanksgiving 2017!,38397,Niki and Gabi
zZ9FciUx6gs,Nickelback - The Betrayal Act III [Official Video],6927,Nickelback
PaJCFHXcWmM,U2 - The Blackout,5389,U2VEVO
goP4Z5wyOlM,Iraq-Iran earthquake: Deadly tremor hits border region - BBC News,308,BBC News
NZFhMSgbKKM,Dennis Smith Jr. and LeBron James go back and forth,7,Ben Rohrbach
0tO_l_Ed5Rs,Matthew Santoro - FACTS (Official Music Video) f. Ellevan & Humble the Poet,15186,MatthewSantoro
STI2fI7sKMo,"AFFAIRS, EX BOYFRIENDS, $18MILLION NET WORTH - GOOGLE US | Shawn and Andrew",4451,Shawn Johnson East
BWPrk9PUwQE,iPhone X vs Makeup Transformation (Face ID TEST),33505,dope2111
ogYum4kWXgk,People are Awesome & The Pet Collective present Pets are Awesome!,3417,People are Awesome
sbcbvuitiTc,Stephon Marbury and Jimmer Fredette fight in China,2017,NBA Highlights · YouTube
zNqCVTs38nU,Heidelberg's nifty hook-and-lateral to the left tackle,35,D3sports.com
DM-ni_LSOFE,"ELDERS REACT TO iPHONE X (Facial Recognition, Animojis)",45406,FBE
0PpNlNJ6Nng,Will It Watermarble?! Sister Edition | Watermarbling 9 random objects in nail polish!,99086,Simply Nailogical
c-3JxzN2u34,Lin-Manuel Miranda's next act: Helping rebuild Puerto Rico,205,CBS Sunday Morning
069D0NmW39o,"Wildest Superstar distractions: WWE Top 10, Nov. 11, 2017",15397,WWE
9t9u_yPEidY,"Jennifer Lopez - Amor, Amor, Amor (Official Video) ft. Wisin",190083,JenniferLopezVEVO
KODzih-pYlU,BLIND(folded) CAKE DECORATING CONTEST (with Molly Burke) // Grace Helbig,7250,Grace Helbig
8NHA23f7LvU,Jason Momoa Wows Hugh Grant With Some Dothraki | The Graham Norton Show,16116,The Graham Norton Show
w0XYVssCKjw,JaVale McGee's Parking Lot Chronicles: Episode 3,5734,Kevin Durant
9XSULcLI6Hg,Kellyanne Conway on Roy Moore This Week Abc: Trump’s Not Being Briefed On This Bit By Bit 11/12/17,21,JimBrowski 96HourNews
pjuPpVLXDQg,Train Swipes Parked Vehicle,89,ViralHog
9xSx-5tmq44,Daddy's Home 2 - Movie Review,8209,Jeremy Jahns
oTObwUiXdYY,"7.3 Magnitude Earthquake Along Iraq-Iran Border Leaves At Least 400 Dead, 7,200 Injured | TIME",52,TIME
1cgK-BIrXes,#VeteransDay: Thank You for Everything,26917,YouTube Spotlight
ujyTQNNjjDU,G-Eazy - The Plan (Official Video),115795,GEazyMusicVEVO
PABlVzeldaM,U.S. Navy Three Carrier Formation in Western Pacific Ocean,493,U.S. Navy
6340tX9M_eM,Batman: Gotham by Gaslight - Exclusive Trailer (2018),8231,IGN
8mhTWqWlQzU,Wearing Online Dollar Store Makeup For A Week,115426,Safiya Nygaard
t4YAyT4ihIQ,Getting My Driver's License | Lele Pons,120876,Lele Pons
MNiweoKXwfg,Watch Norman Reedus Come Face to Face with his ‘Walking Dead’ Double,203,INSIDER
Jw1Y-zhQURU,John Lewis Christmas Ad 2017 - #MozTheMonster,55681,John Lewis
2Vv-BfVoq4g,Ed Sheeran - Perfect (Official Music Video),1634124,Ed Sheeran
UFYCTJlayS4,Top 10 iPhone Apps for Productivity & Content Creation,2233,Sara Dietschy
cccyOn99s4Y,Reacting to Running a Half Marathon | MEGANBYTES EP. 101,2978,MeganBatoon
abGCYPCk294,"Justice League Reactions, Should Disney Buy Netflix - The John Campea Show",1550,John Campea
lY_0mkYDZDU,Foster The People - Sit Next to Me (Official Video),18603,fosterthepeopleVEVO
k8NxqyGcZA4,Rosie O’Donnell On Donald Trump’s Hostility Toward Her | WWHL,2429,Watch What Happens Live with Andy Cohen
IE-xepGLVt8,Mayo Clinic's first face transplant patient meets donor’s family,1896,Mayo Clinic
ObIQ0s02UHg,Jason Derulo - Tip Toe feat. French Montana (Official Lyric Video),37669,Jason Derulo
cOc3tsFWoRs,Jason Momoa & Lisa Bonet: Love at First Sight,15504,The Late Late Show with James Corden
AJYb0Yom5UQ,Howard Stern: George Takei Talks About Harvey Weinstein and Sexually Assault,355,cocheusadoooo
gLswXiRLdkA,A VERY #EXTRA EBAY SHOPPING HAUL!,23296,Amber Scholl
MyEqfBkzESU,EXTREME GOLDEN TAN TRANSFORMATION,8133,John Maclean
wJYE0sFOteE,Inside the Cheese-Aging Caves 30 Feet Under Brooklyn | I Got a Guy | Bon Appétit,2323,Bon Appétit
L_5_slz4ke4,Some NFL players call for an end to Thursday night football after 8 players were injured last week,67,ABC News
OKoL852K9uA,ICE PRIMER? DOES IT WORK?!,3571,mayratouchofglam
pa_oUisZZy0,Mark Ruffalo Reads Hilarious Thirst Tweets,6271,BuzzFeed Celeb
fNtLIcyjsnI,"Game Night Official Trailer #1 (2018) Rachel McAdams, Jason Bateman Comedy Movie HD",16430,Zero Media
_Iz83-Cmt6A,Little Big Town with Jimmy Webb - Wichita Lineman (Live from the CMA Awards),439,CMAVEVO
YlvCVbfS9M0,Alan Walker - All Falls Down (Behind The Scenes),34839,Alan Walker
arJ5h2TY3I4,FANTASY (feat. Amber Liu) by SUPERFRUIT,82320,SUPERFRUIT
gEHCXl4J9Qo,Taylor Swift - “New Year’s Day” Fan Performance,72593,ABC Television Network
-OK9i1_YYYc,Animal Adventure Park Giraffe Cam,2282,Animal Adventure Park
b4vTZx_AtHk,How To Dry a Shirt in 30 Seconds,98804,HowToBasic
kOnQocd799Y,Everything Wrong With Baby Driver In 14 Minutes Or Less,58967,CinemaSins
e4FApt6z55c,Kimbra - Top of the World (Official Music Video),8599,kimbramusic
2XK4omx9uMU,Camila Cabello COMPLETELY NAILS 'Finish The Lyric',40195,Capital FM
xfmipNU4Odc,Edna's registered owner thought she was dead for 2 years!!!,16396,Hope For Paws - Official Rescue Channel
jp9hK-jY6yY,When Someone Has A Crush on You | Lilly Singh,202676,IISuperwomanII
RkHuWjiR-LM,Neck Deep - Parachute (Official Music Video),14338,Hopeless Records
fCTKDn3Q8xQ,Idiot's Guide to Japanese Squat Toilets,43875,Rachel and Jun
DIU3xPdhCBI,Sam Smith surprises brides at their wedding! (At The BBC),22326,BBC Music
wnwF1FHybDQ,Mark Wahlberg's Kids Use Him for His Celeb Connections,1731,Late Night with Seth Meyers
9oFP-pOMNwE,H&M Holiday 2017 starring Nicki Minaj – official teaser,3283,H&M
g5c1bk8weaQ,FIRST TIME IM DOING THIS! TALKS WITH LIZA.,307435,Liza Koshy
yuBqWcSKrCk,"Owen Wilson on Meeting Julia Roberts, and Tandem Biking",3305,TheEllenShow
x9mh-SwSKas,Surprise After Surprise | October Vlog,10138,clothesencounters
uiA4B5Y63IQ,THE SHAPE OF WATER - Final Trailer,3327,FoxSearchlight
viyRD5z6ilQ,Luke Bryan - O Holy Night (Audio),5048,LukeBryanVEVO
QFfEtKvXMAs,Niall Horan - Too Much To Ask (Acoustic),53572,NiallHoranVEVO
xg9ebVTL9yE,Empire Of The Sun - Way To Go,7999,empireofthesunvevo
fbHbTBP_u7U,NF - Let You Down,88417,NFVEVO
QOksZ8VogRw,Bastille - World Gone Mad (from Bright: The Album) [Official Music Video],25115,Atlantic Records
RYs08kX3Ih4,SECRETS REVEALED! HOW I LAY MY LACE WIGS! | AALIYAHJAY,14303,MsAaliyahJay
tOFkFZbPdnQ,Typical audience reaction to a bass solo...,7693,Danny Sapko
dW4wpGg64pE,Meryl Streep Meets Anna Wintour at Vogue,25122,Vogue
2VP846QcA_4,I Trained To Become Batman 🦇 (Justice League),4417,Michelle Khare
_dhneCO4YEE,"Russian Bots and Trolls | November 8, 2017 Act 2 | Full Frontal on TBS",5505,Full Frontal with Samantha Bee
EYkEshCOhEU,The Ultimate Red Lip Look | Nicole Guerriero,15247,Nicole Guerriero
Rq9-mW6HgQE,Sean Astin Knew Nothing About 'Lord Of The Rings' Once Upon A Time,11616,The Late Show with Stephen Colbert
k29YnfttqEU,Mean Tweets – Country Music Edition #3,9312,Jimmy Kimmel Live
Eg_kW5fw6qU,Could Anastasia Become A Disney Princess?,9091,SuperCarlinBrothers
J_QGZspO4gg,Sia - Snowman,84426,SiaVEVO
PkRBTF6nt4E,Tesla's biggest problem is one nobody saw coming,935,Business Insider
htvR_dBs3eg,Sam Smith - The Thrill of It All ALBUM REVIEW,2926,theneedledrop
qEEtzzi1EII,Birthdays - Simon's Cat | GUIDE TO,19323,Simon's Cat
1Wk8ZRgXQnY,Andy Grammer - The Good Parts (Official Audio),1365,Andy Grammer
8l_e6bx8UG8,Remy Ma - Wake Me Up (Audio) ft. Lil' Kim,32648,RemyMaVEVO
lsfzA7sWlOM,L.A. Noire - Nintendo Switch Trailer,7683,Nintendo
RQDphL2MVlM,Everything I Wore This Week! Outfit Diary 1,3652,Dina Tokio
X7flefV8tec,"President Bill Clinton On Dictators, Democracy, & Why We Need Immigrants More Than Ever",4364,Team Coco
cYw-oyJ7AEY,"Pitbull, Stereotypes - Jungle (Lyric Video) ft. E-40, Abraham Mateo",11736,PitbullVEVO
6nJw-jPQYVI,A Day in The Life of David Letterman,1345,Late Show with David Letterman
5x1FAiIq_pQ,Alicia Keys - When You Were Gone,1354,Alicia Keys
LMCuKltaY3M,Elbow - Golden Slumbers (John Lewis Advert 2017),2163,ElbowVEVO
6Detw08jRhs,MDNA SKIN: Express Yourself,443,MDNA SKIN
vd4zwINEcLY,Live in the now!,909,poofables
7fm7mll2qvg,Sigrid - Strangers (Lyric Video),4604,SigridVEVO
eHIY3HNNqzM,The Script - Arms Open (Acoustic) [Audio],7158,TheScriptVEVO
q-WipZ9p0wk,Three meals that cost me $1.50 each,1991,Brothers Green Eats
zy0b9e40tK8,Dark | Official Trailer [HD] | Netflix,5642,Netflix
rL4WkebTT_U,Where is TOKYO'S GREATEST View?,9210,Abroad in Japan
Y6eKxjMA9ek,"Dropping And CATCHING A Paper Airplane At 2,000 Feet!",15909,Tucker Gott
Q6Usd3_fbq8,Improvising in the style of different classical composers | Practice Notes 34,242,Nahre Sol
44NYFvhXmW8,Thirty Seconds To Mars - Walk On Water (Official Music Video),65854,ThirtySecondsToMarsVEVO
9wg3v-01yKQ,Harry Styles - Kiwi,810895,HarryStylesVEVO
F-j_6IuaYfw,I Miss the Old Taylor,16106,Wong Fu Productions
_qSW96a2aKY,Keith Urban - Female (Official Audio),11985,Keith Urban
afgvlR9WmIQ,Maroon 5 - What Lovers Do (Live On The Ellen DeGeneres Show/2017),20159,Maroon5VEVO
_CJN_ryETIY,Harry Styles canta Sign Of The Times a X Factor Italia - Live Show 3,10175,X Factor Italia
P4YJwy_T9pM,I Picked My Girlfriend's Outfit Blindfolded,31892,Tyler Williams
YqH4eWR7jDQ,"The Oak Beams of New College, Oxford",49,Stewart Brand
r96KpNTcog4,THE MOMENTS BETWEEN THE MONTAGE | Chris & Jack,4989,Chris and Jack
B4gXsobd_ao,What Are Diminutives – and Why We Like Them,3809,The School of Life
x8eLIJAM58M,KUWTK | Scott Gets Upset Over Being Uninvited to Khloe K.'s Party | E!,5894,E! Entertainment
6V_aZsATDsM,"Chapter 28: I Love My Baby But, I Miss My Dad",1170,Whitney Port
qg0GdM60syI,Huffy Metaloid Bicycle Commercial 1997,2,90s Commercials
8j_BYfVEyhA,"O.T. Genasis Talks About His Come Up, Opens Up About His Son's Autism  + More",5075,Breakfast Club Power 105.1 FM
9ymjcSvEyhk,Enter Shikari - The Sights (Official Video),3959,Enter Shikari
oB3SAI2oCqk,Caterham Chris Hoy 60 Second Donut Challenge,22,Caterham Cars
HNa_UWX51_s,Last Friday Night - Katy Perry ('40s Jazz Vibes Style Cover) ft. Olivia Kuper Harris,10844,PostmodernJukebox
5Smb3tZD1Qc,Tamar Braxton Talks Divorce In First Interview,3454,Tamar Chronicles
YHDbsyyjld0,A Tropical Island with 500 CATS!,4250,Kitten Lady
uyl6WtHEYOQ,Fire breathing full twist backflips in one minute - Guinness World Records Day,681,Guinness World Records
bhoFXkVy8JA,Basmati Blues - Trailer,40,Blockbuster
_w58R1OGQFA,Train - Have Yourself a Merry Little Christmas,569,TrainVEVO
BEweWXa5Twk,FACE SURGERY WITH MAKEUP,23634,Christen Dominique
egXr0PU-kCY,BEAUTY GURU GETS A MAKEOVER... FINALE,47793,James Charles
fIQ2Ty2OL34,"James Harden Triple-Double 2017.11.09 vs Cavs - 35 Pts, 13 Asts, 11 Rebs, 5 Stls, 2 GOOD!",420,FreeDawkins
d_j512i2k6c,Could an Earthquake Destroy USA - Biggest Earthquakes Ever,5748,The Infographics Show
DOIw62TXYkg,GoPro Gets Melted by Lava and Survives,2707,PetaPixel
0lbJHqAGpbA,Dog reunites with her family,258,RM Videos
JuP1Z8xpRb8,Brian Justin Crum - Wild Side,1666,BrianJustinCrum
CR9zYgr84QY,Chocolate Orange Autumn Cupcakes | Cupcake Jemma,5723,CupcakeJemma
1640fZpYBSY,I love the Price is Right! Wooo! -Kevin,1211,Anaki Abo
M2-IpsWQUWs,Katy Perry - Swish Swish (Behind the Scenes with Just Dance),6243,Katy Perry
7m630xvAJtA,I'm With Her - See You Around [Official Audio],121,I'm With Her
510KQ_LXGww,My Every Day Autumn Makeup | Zoella,86207,Zoella
CO9dIyNM_9Q,Pitcher Roy Halladay Dies After Crashing ICON A5 Plane He Promoted in October (File),633,Storyful News
hX643KbiI4s,Selena Gomez Singing Wolves and It Ain't Me FULL Instagram Live | Acoustic,998,Tu Fan
mwpHSMv1pI4,Girlfriend Gives Me A Surprise Makeover!? | Hannah Hart,15130,MyHarto
Mfiim71QdYQ,Obama arrives for jury duty at Daley Center,426,Chicago Sun-Times
o78x918zbFk,TOTAL FAIL! NATASHA DENONA HOLIDAY WTF,56867,Tati
6ixU_vdE0Es,BOYFRIEND DOES MY MAKEUP | Madelaine Petsch,20289,Madelaine Petsch
wRGldR_SQAA,Apple Clips sample,0,Steve Kovach
agKDPntMv-E,Stephen A. Smith slams the Philadelphia 76ers for its 'Trust The Process' | First Take | ESPN,4037,ESPN
Xl38SuxyrgM,"STEPH CURRY and OMRI CASSPI, postgame GSW (9-3) vs MIN: peaking?, turnovers, Casspi role",147,LetsGoWarriors
u7pV4vxD1bs,World's first self-driving shuttle crashes on first day of use,57,KSNV News 3 Las Vegas
zYWt2mnalP8,How To Do Thanksgiving Makeup That Has Nothing To Do With The 566 Federally Recognized Tribes,8388,Sailor J
PoNWU2cox9w,Inside Keanu Reeves' Custom Motorcycle Shop | WIRED,16352,WIRED
MCW5HUkrr-o,Impossible Active Audio Noise Cancelling by Muzo,29990,ElectroBOOM
YvfYK0EEhK4,Brent Pella - Why You Shouldn't Fly on Spirit Airlines,14132,Brent Pella
cxMvzK2OQTw,Cards Against Humanity Saves America,4854,Cards Against Humanity
bAkEd8r7Nnw,Slow Mo Katana Sword - 4K - The Slow Mo Guys,63995,The Slow Mo Guys
ItYOdWRo0JY,Selling My iPhone X To a Machine at Walmart,28647,TechSmartt
5530I_pYjbo,How I Trained My Cats,87615,JunsKitchen
dUMH6DVYskc,Ten-Year-Old's Face Unlocks Face ID on His Mom's iPhone X,3687,Attaullah Malik
gjXrm2Q-te4,Jimmy Fallon Pays Tribute to His Mother Gloria,58474,The Tonight Show Starring Jimmy Fallon
VsYmwBOYfW8,Mean Tweets – Jimmy Kimmel Edition,35529,Jimmy Kimmel Live
CtBca6H6Teg,Honest Trailers - Batman Forever,25109,Screen Junkies
pcWKpGzhgq4,Jason Momoa Shows Off His Aquaman Quindent | The Graham Norton Show,5939,The Graham Norton Show
L3br0klRqF4,Watch live: Sessions testifies to the House Judiciary Committee,580,Washington Post
9kF9xY74h-E,Spilling Tea About Each Other!!,122347,Dolan Twins
p2EY93WfBQk,Is the Morphe 3502 Palette Worth the Hype? | Jackie Aina,17130,Jackie Aina
xL_qpDkF5A8,American Crime Story Season 2: The Assassination of Gianni Versace Trailer (HD),478,TV Promos
eQVhAN7-IAw,The Making of a Song: “Delicate” – watch more on Taylor Swift NOW,16754,Taylor Swift
Y9nDagqKL7Q,venting online about a hard part in a video game,25188,ProZD
DbJ2s_g1oDc,10 LIFE HACKS YOU NEED TO KNOW with TEENS (REACT),20518,REACT
KJ12FVmumeA,Stephen A. Smith: Jay Cutler is a 'disease' | First Take | ESPN,1197,ESPN
qDAxDcjgn-8,Taylor Swift - Reputation ALBUM REVIEW,6310,theneedledrop
815lSYphlbw,Japanese Food Tour with Frank Pinello and Sakura Yagi | Sean in the Wild,5198,First We Feast
E_86MEdNsAI,DISNEY SENT MICKEY MOUSE TO MY HOUSE!,4553,Brian Hull
Cr9oGxr0Qa0,Making Sandals with Zip-Ties and a Laser,6095,William Osman
g0K5QoEj7FQ,Does Gwen Stefani Know If Blake Shelton Is People's Sexiest Man Alive? | Access Hollywood,62,Access Hollywood
l4bAoNAx2uo,American Things Europeans Find Weird,9805,The Infographics Show
TSqwDQHE1J8,Carey Mulligan Doesn't Tell People She's an Actress,1145,Late Night with Seth Meyers
MltuW2kcREI,funfetti is extremely fun,12229,emma chamberlain
jGiqc3HSxEg,A Study of So Bad It's Good Movies,11131,Now You See It
XrDlDj9DfZs,Lindsey and​ Mark’s - Iconic Dance - Dancing with the Stars,975,Dancing With The Stars
Z3OZyb2iWqQ,Colin Farrell Dishes on Rendezvous with Girlfriend,1950,TheEllenShow
Hq89wYzOjfs,Amazon CEO Jeff Bezos and brother Mark give a rare interview about growing up and secrets to success,61,Summit
vZzIS17HexE,Taylor Swift Instagram Story - Target 11/14/17,75,reputationswift
yZGSIpcAfEo,Willie Reed and Joel Embiid Fight！Embiid saying HE CANT FUCKIN GUARD ME!,87,DunkFest
zxUwbflE1SY,100 People Hold Their Breath for as Long as They Can,5162,Cut
7oRdswHqaf8,EARL GREY MACARONS- The Scran Line,1440,The Scran Line
qC0I5PEhkJo,The perfect ice - Ice boats on Lake Geneva,136,MattMasonPhotography
0zk2SwmCpss,"Joel Embiid Full Highlights 2017.11.13 at Clippers - 32 Points, 16 Rebs, UNSTOPPABLE!",831,FreeDawkins
SGVbdo2CkgI,Victoria Beckham Gives Strangers Fashion Advice for $2 in Central Park | Vanity Fair,563,Vanity Fair
NfLVVJOuY5M,Stunning MTB masterclass: Matt Jones | Frames Of Mind,6310,Red Bull
F388-6yDDpc,Cowboys vs. Falcons | NFL Week 10 Game Highlights,5715,NFL
KhdecX0qjNA,Demi Lovato - Sorry Not Sorry in the Live Lounge,7129,BBCRadio1VEVO
kWIzjMWmuYk,UNISEX TRY ON/CLOTHING HAUL & GIVEAWAY!!!,4303,Mark Ferris
symdi5KSJts,Model Fei Fei Sun Perform Skin-Care Magic | Beauty Secrets | Vogue,5246,Vogue
5hEJsoDP2q4,"Justice League | “Come Together” | Todrick Hall, J.Fla, Mario Bautista, Samantha Harvey, Clara Marz",11576,todrickhall
lBHPVE3AI6Y,Iran-Iraq border earthquake is deadliest of 2017 - BBC News,398,BBC News
kIUHDwn51y8,Evolution of the Jeep 4x4 Utility Vehicle | Donut Media,2229,Donut Media
Lz7dya576HY,Why a New York Ice Cream Shop is Releasing Ham Ice Cream — The Meat Show,586,Eater
kqmhCaF5_44,HANSON - Finally It's Christmas (Official Lyric Video),930,HANSON
eAyxMv4IBH8,Review of the ION Bottleless Water Cooler,6240,Frank May
EJu_wPGFTw0,"Joel Embiid on win over Clippers, scuffle with Willie Reed and using social media | NBA on ESPN",33,NBA on ESPN
MKLlDnUqho4,Dead Beat Sirah ft. Skrillex (official video),1322,SIRAH
wwZ-T_WQ03A,Rick and Morty: Why Morty Matters,5847,ScreenPrism
i-LCORFB860,Lightning Strike' B777-300 on departure @ KL743 // PH-BVS,386,Valk Aviation
vWYyZMH_QjA,Casey Neistat made a video about me,4293,Shantell Martin
VJlSq6h0LNg,HOL HD: Mike Riley Monday Press Conference,18,Gregg Peterson
ijJPFowBsBc,HUGE BEAUTY FAVOURITES! AUTUMN LOVES!,4170,Estée Lalonde
HBS9783c0BI,Jaden Smith: Watch Me,3218,The Late Late Show with James Corden
JwboxqDylgg,"Canada Soccer's Women's National Team v USA International Friendly LIVE from Avaya Stadium, San Jose",296,Canada Soccer
1WDj0DddCcM,WATCH: Sen. Mitch McConnell on tax reform,11,WLKY News Louisville
bqgVB6Vl-lI,All of Jim's Best Pranks  - The Office US,4548,The Office US
ZhSk8mPSWCg,Lord of the Rings' TV Series Gets Multi-Season Order At Amazon | News Flash | Entertainment Weekly,47,Entertainment Weekly
qooQd8AA7_M,"Camila Cabello, Daddy Yankee - Havana (Remix - Audio)",408618,CamilaCabelloVEVO
9KIP-Ncp2jU,Bill Gates bought land in Arizona to build tech city,170,12 News
i4YQRLQVixM,How Bkav tricked iPhone X's Face ID with a mask,2540,Bkav Corp
Fyyua5JzD9w,Baby loves Jeopardy!,382,Daelric
9Th4qTv-4jE,dapulse is now monday.com. And there's a good reason why.,17,"monday.com, formerly dapulse"
uTH--XRCGxM,5 Strange Things That Happened to Stranger Things’ Joe Keery on His GQ Photo Shoot,3128,GQ
ttf_EzEkxBk,"Roy Halladay Plane Crash Video, Witnesses Say He Was Showboating | TMZ Sports",5934,TMZSports
l7je4VAUvjA,World's First Engagement Ring Phone Case,211,Caters Clips
hpapqEeb36k,Pumpkin Pie - You Suck at Cooking (episode 68),24442,You Suck At Cooking
cmoknv58jjE,FLIPPING OVER SUPERCAR! *GONE VERY WRONG*,57470,Tanner Braungardt
EEIP1YpFXrE,Our First Date,17784,iHasCupquake
pgjRX9oGF7g,Justice League - Movie Review,24672,Jeremy Jahns
_BVAJ3PXZ1k,The all-American fruit you've probably never heard of,12633,Vox
8hKbIhrb1WU,Kim Kardashian Lets Gender of Third Child Slip,29898,TheEllenShow
RTaDvKMtUeA,Larry David Outtakes – Mean Tweets About Jimmy Kimmel,13283,Jimmy Kimmel Live
jG1JY0rt2Os,Fall Out Boy - HOLD ME TIGHT OR DON’T,114661,FallOutBoyVEVO
RrhSJzM8NLE,alt-J - Pleader (Official Video),6260,alt-J
UwdLlnPaRAU,Tony Hawk Answers Skateboarding Questions From Twitter | Tech Support | WIRED,9435,WIRED
ve3oQBjcAGI,Everything Wrong With Wonder Woman In 14 Minutes Or Less,43974,CinemaSins
C4YNcqNF4hg,Joe Keery Talks About His Famous Hair,3802,Late Night with Seth Meyers
k1cA-Wh3Tc0,Peephole Reverser? | 9 Pointless Tech Gadgets!,17286,Matthias
TN5jzDgORqQ,KUWTK | Kris Jenner Brings Her Personal Scribe to Lunch | E!,2207,E! Entertainment
9Ca8zWJOlFQ,Apple iPhone X Review: The Best Yet!,77531,Marques Brownlee
mcqWcLDUeag,Kim Kardashian Explains Her Family's Rumor Control Rule,259,Movie Munchies
4SANXNco_y4,Dashboard Confessional: We Fight (Official Audio),2793,Fueled By Ramen
-oXybog2IuI,24 Facts about Koalas - mental_floss List Show Ep. 522,979,Mental Floss
oRF2-ZloSqg,"AJ Styles & Daniel Bryan warn Brock Lesnar about what awaits him: SmackDown LIVE, Nov. 14, 2017",17929,WWE
lzgQrHFDNLE,What Does A Cochlear Implant Sound Like?,6932,SciShow
0ANDjPQPS_Q,♡ SILVER PLAYBUTTON UNBOXING (and making it cute) ♡,2325,Pixielocks
4ftGS_6i7mM,Bill Belichick Addresses the Midshipmen | A SEASON WITH NAVY FOOTBALL | SHOWTIME,84,SHOWTIME Sports
upEIZAihcwo,Devin Booker has words with Lakers assistant Jesse Mermuys,7,NBA Highlights · YouTube
Jidk0O6uu-0,Granulated Sugar From Honey,3835,Cody'sLab Backup
64IIfxDrhJY,Titanic (2017) - Dolby Vision Trailer,455,Paramount Pictures
k-w8GxCpsCU,John Collins' Best Dunks So Far This Season,19,Atlanta Hawks
yxFdue1dCtE,NBA Daily Show: Nov. 14 - The Starters,1935,NBA
aAm6AHr14zY,Devin Booker And Julius Randle Wildcats Fight！“You The Full Of Shit”！,93,DunkFest
ryqZUqgjvW8,Justice League - Movie Review Is It What We've Been Waiting For?,2349,ColliderVideos
FEjZiCPuvqQ,A New Hybrid Cat Arrives,1741,Big Cat Rescue
ENr6CXm1YxU,Rachel Platten - Whole Heart (Audio),1350,RachelPlattenVEVO
3x0usYgljOk,"Jayson Tatum Full Highlights 2017.11.14 at Nets - 19 Pts, 3 Stls, SMOOTH!",252,FreeDawkins
R9c-_neaxeU,MENACE: the pile of matchboxes which can learn,5140,standupmaths
VonJ4ASDO40,Remy Ma is on Top of the World,8895,Wendy Williams
GKUE2U2qlzY,Jordan​ and​ ​Lindsay’s - Iconic Dance - Dancing with the Stars,4064,Dancing With The Stars
N0tmF4j4K6g,What Does It Take To Be A Blue Planet II Cameraman? #OurBluePlanet - BBC Earth,1699,BBC Earth
SFdO-19Xdho,Clean Bandit - I Miss You feat. Julia Michaels in the Radio 1 Live Lounge,1679,BBC Radio 1
qK8AcryiniI,Donald Trump makes ASEAN handshake photo op go awry,39,Rappler
KLZl_sxSN_g,WWSB Channel 7:   Sarasota Police stepping up pedestrian and bicyclist safety enforcement,4,Sarasota Police Department
-JVITToppE0,Coach Taggart Monday Presser Ahead of Arizona,10,GoDucksdotcom
sH0Agabp3Rs,Lord of the Rings TV Series Lands At Amazon & Will Explore New Stories,280,Hybrid Network
eijd-yjXY9E,Apple iPhone X - One Week Later,427,Mark Linsangan
fGTfbMioezc,Marvel's Inhumans,20,LOFTON SHAW
8tbQHHso0oY,Bellator 187: Conor McGregor storms the Bellator MMA Cage,1988,BellatorMMA
G8gJ4RTBxcg,Coconut crab hunts seabird,111,New Scientist
fRj34o4hN4I,"What's new, Atlas?",65594,BostonDynamics
coOKvrsmQiI,RAMPAGE - OFFICIAL TRAILER 1 [HD],40775,Warner Bros. Pictures
p8XP7A7kvzM,Spill Your Guts or Fill Your Guts w/ Kim Kardashian,119107,The Late Late Show with James Corden
p9wE8dyzEJE,A Quiet Place (2018) - Official Teaser Trailer - Paramount Pictures,6729,Paramount Pictures
duRDizP0gHQ,Bob Saget Hiccups Uncontrollably While Eating Spicy Wings | Hot Ones,28309,First We Feast
0O2IAz1E9Ts,Miranda Sings Hijacks a Stranger's Tinder | Vanity Fair,12594,Vanity Fair
16W7c0mb-rE,Emergence – How Stupid Things Become Smart Together,88541,Kurzgesagt – In a Nutshell
nRafaCcfrcI,73 Questions With Liza Koshy | Vogue,281095,Vogue
t1shnJT8NCY,"We Can All Do Better Than Roy Moore | November 15, 2017 Act 1 | Full Frontal on TBS",5666,Full Frontal with Samantha Bee
ixxR3ZoqnF0,BTS (방탄소년단) 'MIC Drop (Steve Aoki Remix)' Official Teaser,789750,ibighit
lJFqvRwOiis,Walking while black,23207,Vox
9PhM-zCmTFs,DIY - Simon's Cat  | NEW BLACK & WHITE!,14355,Simon's Cat
vKbyfdJXoDg,Jordan Peele Crashed A 'Get Out' College Course,6593,The Late Show with Stephen Colbert
Nz0qoOgyWSQ,"The Talk - Eve Reacts to Nicki Minaj's Racy Magazine Cover, 'I just don't think it's right'",1326,The Talk
