video_id,title,likes,channel_title
in5TfQfUIBY,Ready Player One Review,6241,IGN
nT39kZDAx_s,Hearty Pizza Dip - Retro Recipe Review - brutalfoods,10918,brutalmoose
uE_dSIumQ5Q,The Pancake Frisbee,7878,Peter Brown
sS0LCjOiIhc,GOT7 Look M/V,858708,jypentertainment
enH3xA4mYcY,SORRY TO BOTHER YOU | Official Trailer,6418,Annapurna Channel
BSHh0MmJM1U,Pizza in Its Purest Form: The Story of Lucali | Food Skills,14961,First We Feast
H2mNDaqOp3o,Stephen A. goes off on Kevin Durant: I don't want to hear you miss Steph Curry | First Take | ESPN,9429,ESPN
3gTyF-wLa-E,Tommy Wiseau Breaks Down a Scene from The Disaster Artist | Notes on a Scene | Vanity Fair,7619,Vanity Fair
bij-JjzCa7o,"Why European Clocks are Running Slow, and British Clocks Aren't",27106,Tom Scott
AU9I1MX0c2s,George Ezra - Saviour (Lyric Video) ft. First Aid Kit,7110,GeorgeEzraVEVO
6Km34EXxGZ4,I React to Mean Comments,72263,TheReportOfTheWeek
wNhYCsu3WWk,My baby boy dancing to MGMT,3471,Johnny Jansen
4a1TUszkMfI,The NCAA tournament is a loser machine | Chart Party,5487,SB Nation
HicAnFGE9bA,Why Do Some Harmonies Sound Prettier Than Others?,5469,SciShow
VvEGctiW7io,Sophie Turner Tests Her Knowledge of Game of Thrones vs. the Runway | Harper's BAZAAR,3381,Harper's BAZAAR
k3uh0MJeypI,Dog Owners Be Like...,115938,IISuperwomanII
V4kfrZSejVc,Video Сhat. The cat is looking for Daddy,9760,CatPusic
1lPvUKtHBJA,"Conor Lamb's Win, Trump's Space Force and #NationalStudentWalkout: A Closer Look",18929,Late Night with Seth Meyers
3y75zBl37f8,Adam Rippon Competes in the Olympics of Eating Spicy Wings | Hot Ones,20914,First We Feast
iZUfPIKbgUM,Bar Essentials | Basics with Babish,21140,Binging with Babish
1SnWTW6YXbE,Charlie Puth - Done For Me (feat. Kehlani) [Official Audio],84227,Charlie Puth
cr6H8ACWp4E,The Cast of ‘All That’ Is Here & No One Can Handle It | Wild 'N Out | MTV,5791,MTV
46KwY26PeOs,Occupied - Cyanide & Happiness Shorts,38061,ExplosmEntertainment
UJIo1AtoTss,Foster The People - Sit Next to Me (Around The World),10784,fosterthepeopleVEVO
hhiD-TKYqHk,Barcelona vs. Chelsea | 2017-18 UEFA Champions League Highlights,3149,FOX Soccer
giiIq7t4oMQ,The 100 | Season 5 Official Extended Trailer | The CW,12535,The CW Television Network
LN-m0Ci8MZ8,How To Make Geometric Pies by lokokitchen,25754,Tasty
98ixGAcR1T4,Ellen Unveils Identity of Kim Kardashian's Surrogate,12087,TheEllenShow
tEmodtG8NV0,I TOOK A COMPATIBILITY TEST w/ MY SOUL MATE!,72128,Gabbie Hanna
ai6NByMmCVU,Disney Princess Pushing A Truck,35842,Daily Dose Of Internet
MYexYwr5Pz4,"Lonzo Ball steps in as Julius Randle, Isaiah Thomas get into heated exchange | ESPN",1910,ESPN
zUrib9ZbraY,Couple Tours A $4 Million Dollar Dream House • Ned & Ariel,43125,BuzzFeedVideo
jVlfNd3fxMY,Tomb Raider - Movie Review,15189,Chris Stuckmann
TN7LvuEpDIE,I tried to recreate my favorite artist's work with makeup | Alex Pardee Inspired Bodypaint Tutorial,27409,Glam&Gore
XrvedhkDN5A,[ASMR?] Accent Tag Challenge - American vs. English,12956,Gibi ASMR
HuwPCUzqwKs,"Milo Manheim, Meg Donnelly - Someday - Ballad (From ZOMBIES)",8142,DisneyMusicVEVO
RnaEqiVnad0,Dogs Try the Viral Egg Challenge,9909,INSIDER
nzPcwk6O1Ks,Angela Bassett Describes The Waterfall Scenes In 'Black Panther',2679,The Late Show with Stephen Colbert
aC5lxLCyyhQ,Life Itself - Teaser Trailer [HD] | Amazon Studios,502,Amazon Studios
bw5bbpxkBQQ,Terry Crews: Kevin Hart Tried To Play Mind Games With Me  - CONAN on TBS,5587,Team Coco
bcPTiiiYDs8,How pi was almost 6.283185...,9791,3Blue1Brown
xgtLKeCkCiw,"The ketogenic diet, explained",6879,Vox
2fouYHWUhZo,Camila Cabello Watches Fan Covers On YouTube | Glamour,46647,Glamour Magazine
7iQn-toQp6A,Benjamin Glaze Auditions for American Idol With Nick Jonas' Levels - American Idol 2018 on ABC,11415,American Idol
QwievZ1Tx-8,Marvel Studios' Avengers: Infinity War - Official Trailer,975715,Marvel Entertainment
ceXPzJ0fZNs,My B-Boy Days,107778,Domics
lgBn6qzMlXw,COLLEGE KIDS REACT TO TOP 10 MOST SUBSCRIBED YOUTUBERS OF ALL TIME,60951,FBE
Sb_hCbZ80aQ,Sumo Wrestling with Conan O’Brien | Kevin Hart: What The Fit Episode 1 | Laugh Out Loud Network,28470,LOL Network
LnA7Au-DLUM,Meat Expert Guesses Cheap vs Expensive Deli Meats | Price Points | Epicurious,8151,Epicurious
MybjFHx_wfc,How Smart Are You? (TEST),22148,AsapSCIENCE
08l0K3UyUXE,Rihanna Claps Back at Snapchat for Domestic Violence Ad Featuring Chris Brown,1778,Inside Edition
LK3Yz9UpP_A,Full Face Testing 5 STAR 100+ REVIEWED Makeup from AMAZON || Full Day Wear Test,7550,RachhLoves
rjLVCpE3kuw,READY PLAYER ONE - Dreamer Trailer [HD],17242,Warner Bros. Pictures
ckS1F3mJzb0,Kendall Jenner Doesn't Have Baby Fever,49237,TheEllenShow
YqC5loCFMtk,THE KATE BOSWORTH MAKEUP LOOK TUTORIAL,7142,Lisa Eldridge
ar8S6virCwM,A day in the life of an ancient Athenian - Robert Garland,12469,TED-Ed
b33PN2NB2Do,The guide book that helped black Americans travel during segregation,11135,Vox
ebHbB2eDz1g,Alicia Vikander Teaches Jimmy a New Swedish Game,4165,The Tonight Show Starring Jimmy Fallon
iSt_jbT6rak,Best Excuse Ever | Anwar Jibawi & Ric Flair,57075,Anwar Jibawi
wAQ7autd61g,The Final Countdown - Europe (Vintage Cabaret Cover) ft. Gunhild Carling,10489,PostmodernJukebox
pCteBhr4dGY,See through Rotary Engine in Slow Motion - (Wankel Engine) 4K,17430,Warped Perception
ZKWDCyVbnoM,"ADRIFT Official Trailer (2018) Shailene Woodley, Sam Claflin Movie HD",14400,ONE Media
RYGFczNMAMk,How Formation Flying Works (feat. the Red Arrows!),13967,Tom Scott
5GRyr0noXrw,BOWLING BALL Vs. TRAMPOLINE from 45m!,212314,How Ridiculous
7tYUMo3IgXg,"New $24,000 Singapore Airlines First-Class Suite",21385,BuzzFeedBlue
SuHVvSsNY2E,Instant classic: Relive UMBC’s incredible win over Virginia in 8 minutes,6565,NCAA March Madness
T_Tx4ZF-TkQ,I Tried To Pancake Art Vs A Pancake Art Robot (Round 2),21567,Guava Juice
4srOE3pCCo8,What's inside Pizza Ordering Shoes?,6749,What's Inside?
bwlEaGiO9Zw,Charades with Aaron Paul and Karlie Kloss,4624,The Tonight Show Starring Jimmy Fallon
zWrMvW7S3tg,The Infinity War trailer but I just name characters as they appear,73891,jacksfilms
T2uyIBURMjs,Sonic Mania Adventures - Sneak Peek,16911,Sonic the Hedgehog
uKkbfxTHJGI,10$ Drum - Faded ( Alan Walker ),60960,Big Marvel
KKD9DLbRak8,Jennifer Garner Doesn't Understand Her Oscars Meme Face Either,16876,TheEllenShow
RE-aVnbJyOU,Alicia Vikander Barely Survived Biking Through London,2034,The Late Late Show with James Corden
9SCNLl0MQPM,Apple Announces March 27th Keynote! What To Expect,14764,EverythingApplePro
lEltmPagx6M,DEMI LOVATO - YOU DON'T DO IT FOR ME ANYMORE (FLASHBACK),47459,James Charles
RyH8TWLribw,"The epic late-night Fortnite stream featuring Drake, JuJu Smith-Schuster, Ninja, Travis Scott | ESPN",3600,ESPN
dyUJN3skBlU,"Nick Robinson on His Mom, His Roommate & His New Movie",6046,Jimmy Kimmel Live
wGjplV12k10,"Floyd Mayweather Grades His MMA Skills, 'I'm Serious About This' | TMZ Sports",4850,TMZSports
9qlF_9PNhJs,The Tree (True Story!) - Simon's Cat | BLACK & WHITE,15535,Simon's Cat
soBb4X5Hb6k,Francia Raisa Explains How She Became Selena Gomez's Kidney Donor | Body Stories | SELF,26217,SELF
rvskMHn0sqQ,A Selfish Argument for Making the World a Better Place – Egoistic Altruism,137893,Kurzgesagt – In a Nutshell
2GjJ85MImlo,HOW I SHAVE MY FACE FOR PERFECT SKIN | PatrickStarrr,22557,PatrickStarrr
ZCPwpcurYns,How To Make Mumble Rap,255975,nigahiga
1n4rqMnxaig,Houston vs. Michigan: Jordan Poole shot beats the buzzer for the win!,3759,NCAA March Madness
sxQ0onDkFqQ,"Top 10 Plays of the Night | March 17, 2018",6385,NBA
sfMwXjNo3Rs,How Spring Looks Like around the World,5047,INSIDER
S5xFft7kg8Q,Adam Scott Hijacks a Stranger's Tinder | Vanity Fair,11834,Vanity Fair
mBMxFIEub34,Jennifer Garner Answers the Web's Most Searched Questions | WIRED,6044,WIRED
YrVTJd6mvpE,"Adam Scott Goes Undercover on Reddit, Instagram, and Twitter | Actually Me | GQ",3579,GQ
oidnwPIeqsI,Brad and Claire Make Sourdough Bread | It's Alive | Bon Appétit,11287,Bon Appétit
fMaC7IeGKNQ,Jeff Goldblum Recorded His Part In Isle Of Dogs Over The Phone  - CONAN on TBS,3929,Team Coco
v3hGUJJIjzk,ALL THE DIY'S WE ACTUALLY KEPT,8950,TheSorryGirls
_UjAxuSuLIc,"How 29,000 Lost Rubber Ducks Helped Map the World's Oceans",11062,Half as Interesting
DxSf6Nb_I7o,Adam Ruins Everything - The Truth about Paul Revere | truTV,2545,truTV
BOKzXQdA4Nw,ISLE OF DOGS | Cast Interviews | FOX Searchlight,4912,FoxSearchlight
2aQykuIaJVI,Lin-Manuel Miranda & Ben Platt Found Tonight [Official Video],57284,Atlantic Records
5fZiMNo5-uo,Irelia: The Blade Dancer | Champion Trailer - League of Legends,42309,League of Legends
RyquDQ5kWSs,"Judge Faith Jenkins On Syndicated Court TV, Fair Representation For Heinous Crimes  + More",6588,Breakfast Club Power 105.1 FM
qYNNT1WIhwM,Twins Audition for American Idol With Bruno Mars Hit - American Idol 2018 on ABC,13050,American Idol
JhvwFB-NUbA,Wendy Williams opens up about her return to TV,2997,Good Morning America
MHh9NWCR_ts,What just happened,32309,Lenarr Young
yWjRvhfjpI8,Talking Kitty Cat - World's Most Spoiled Cat,25413,Talking Kitty Cat
BXnGUUsdnR8,I Let My Dog Walk Me For A Day!,18993,Guava Juice
XgbFJUpbk8A,After Show: Would Iggy Azalea Collaborate With Cardi B? | WWHL,1680,Watch What Happens Live with Andy Cohen
oYe-QM8ZimI,ASKING MY CRUSH TO FLY TO PARIS FOR DREAM DATE,45517,Yes Theory
W-FxnLAnlGg,Nevada comes back from 22 points down to knock off Cincinnati,1617,NCAA March Madness
QsK6c2dRhv0,"Top 5 Plays of the Night | March 18, 2018",3235,NBA
MVyvV0tOOjw,QUADRUPLE NECK BASS SOLO,32390,Davie504
hHFuZVGpBC0,Crushing and Slicing Red Hot Steel with Hydraulic Press,9926,Hydraulic Press Channel
ffgzh93MdQM,"Keyboard Cat, Bento, A Tribute",8144,Keyboard Cat
Nkl-k_rjn_U,Jason Aldean - Rearview Town (Lyric Video),5642,JasonAldeanVEVO
8UHMSVOHddE,Chris Stapleton - I Want Love (Audio),4753,ChrisStapletonVEVO
DCUD9kjYOAk,"Sabrina Carpenter, Jonas Blue - Alien (Audio Only)",60711,SabrinaCarpenterVEVO
iXfHlch1Lso,Kim Kardashian West Fixes Internet Headlines About Her and Her Family | ELLE,2904,ELLE
Sg_Gmb0ntfw,The Handmaid’s Tale Season 2 Teaser (Official) • The Handmaid's Tale on Hulu,1293,Hulu
FhwktRDG_aQ,WON'T YOU BE MY NEIGHBOR? - Official Trailer [HD] - In Select Theaters June 8,36918,Focus Features
kjC1zmZo30U,TAG - Official Trailer 1,17322,Warner Bros. Pictures
JR06IhY4C2A,Officials give update on shooting at high school in Maryland,4756,ABC News
FFsp5b4AUTE,"Roman Reigns is brutally ambushed by Brock Lesnar: Raw, March 19, 2018",73399,WWE
Z4qNw1dPuNI,How I Get Ready With My Disability,23971,As/Is
vus2jCm8H0U,BEST DRUGSTORE MAKEUP UNDER $6,36758,Tati
DfxhWPvhFCQ,Iggy Azalea Burned Nick Young's Designer Clothes | WWHL,2793,Watch What Happens Live with Andy Cohen
Gzy_nCkn88U,Samsung Galaxy S9 Review: The Perfect... Samsung!,60111,Marques Brownlee
z1Fvrmf4BXc,MY GIRLFRIEND IS MOVING INTO OUR NEW HOUSE?!,202649,Lucas and Marcus
B2W7c3XRBwQ,How To Make a Easter GIANT PEEP CAKE | With Yellow Velvet Cake | Yolanda Gampp | How To Cake It,13259,How To Cake It
7gdoj1ViJ8M,RED DEAD REDEMPTION HORSESHOE COOKIES ft sWooZie! - NERDY NUMMIES,8520,Rosanna Pansino
WAX8tyQnTpU,CURRENT GO TO MAKEUP ROUTINE  (No Foundation),23648,KathleenLights
0r-zYs6NQu8,What If You Didn't Sleep For A Week? ft. TheOdd1sOut,45703,Life Noggin
LLiXwMQW_VQ,Is BIGGER BETTER ? - INSANE GIANT LIGHTER Tests,3538,BrainfooTV
T3-BzlYEhQA,"Inside FC Barcelona’s ambitious plan to reinvent the Camp Nou, by Wired and Audifootball",10777,FC Barcelona
EL1wN_ihL_E,Jurassic Park Auditions - SNL,29035,Saturday Night Live
bWL_MVbpGT0,4 PRODUCERS FLIP THE SAME SAMPLE,19081,ANDREW HUANG
vvUe5hNEXwE,Stephen A. Smith reacts to Tyronn Lue stepping away from Cavaliers | First Take | ESPN,2934,ESPN
2XQft9iwSqg,SING ANYTHING CHALLENGE,14112,Cimorelli
wQFsKrYLd10,My Everyday Makeup Routine!,4895,Lindsay Webster
XCrJ3NflOpE,A New View of the Moon,4526,To Scale:
PHLY4a5fTjU,I Bought A Full Face Of Makeup From Facebook Ads,123059,Safiya Nygaard
_vrcsnkXCI8,I GAVE MY MOM HER FIRST MAKEOVER EVER AND SHE CRIED,24190,Bramty Juliette
9DUfFHaUpxg,The Voice Behind 250 of Your Favorite Cartoons,24278,Great Big Story
9x8JN8zDqis,I WENT ON A DATE WITH HER BOYFRIEND!,32101,Gabbie Hanna
trWLY6NrS2Q,Honest Trailers - Every Wes Anderson Movie,45115,Screen Junkies
NC-TF0SPzzM,Bill Hader Reveals What Made Him Break on SNL,7718,Late Night with Seth Meyers
_IoOJu2_FKE,How Ticks Dig In With a Mouth Full of Hooks | Deep Look,6751,Deep Look
5mar5AHglGI,These Things Happened (Artist Spotlight Story) - G-Eazy,20083,G-Eazy
umPDFJkH3_M,Will Stress Really Make You Go Gray?,6304,SciShow
XKrV_JqZX1Q,Name That Song Challenge with Blake Shelton,15264,The Tonight Show Starring Jimmy Fallon
22iCU_bsApA,First Take interviews Trae Young after he declares for NBA draft | First Take | ESPN,4975,ESPN
IgUlowmSeHo,How A Messed Up Childhood Affects You In Adulthood,8669,The School of Life
43hsIO_Jxtg,Tessa Virtue & Scott Moir Are 'Definitely Not Dating',14025,TheEllenShow
-4s2MeUgduo,The Weirdest Mystery Tech Yet...,38776,Austin Evans
szFrHKoD1GE,70 People from 70 Countries Sing Their Country's National Anthem | Condé Nast Traveler,12736,Condé Nast Traveler
bVMVxJJ7P8M,Cannibalism in the animal kingdom - Bill Schutt,12145,TED-Ed
Biex1XR_mpo,50 Mums | 50 Kids | 1 Extra Chromosome,39754,Wouldn't Change a Thing
jzIE_oKG9PU,Spill Your Guts or Fill Your Guts w/ Drew Barrymore & John Boyega,28302,The Late Late Show with James Corden
qPZ38A7nhqY,Fantastic Beasts Trailer Quiz,6967,Good Mythical Morning
OZsYiWBgFOk,"The Spy Who Dumped Me (2018 Movie) Teaser Trailer – Mila Kunis, Kate McKinnon, Sam Heughan",6398,Lionsgate Movies
UmXbLTbi8Hg,Safe Neighborhood - Cyanide & Happiness Shorts,33684,ExplosmEntertainment
c1npkEoEtos,Kindergarten Weather Report,27318,Charlie Corts
Q9vZHbcx6cQ,David Guetta & Sia - Flames (Lyric Video),49074,David Guetta
IlkBLwl4aBM,Shawn Mendes In My Blood (Audio),598021,Shawn Mendes
H2nY7Tu1Qgs,Pastry Chef Attempts To Make Gourmet Cheetos | Bon Appétit,21705,Bon Appétit
54BVvP7zvDQ,Queer Eye's Tan France Takes Pete Davidson Shopping - SNL,25151,Saturday Night Live
OcTw2b0Ho-8,FALSE LASHES: Do's and Don'ts | For Beginners!,30931,Laura Lee
4FEcHK-c2VE,Couple Buys A House For The First Time • Ned & Ariel,49630,BuzzFeedVideo
mwgUesU1pz4,Under the Silver Lake | Official Trailer HD | A24,9520,A24
rwFfo61fVSY,Pouring water down a 50 meter well.,1945,Unecht Erfunden
Vp40y-048MA,"Top 10 Plays of the Night | March 21, 2018",3711,NBA
zGD3Qvb04gc,Hilary Swank And Stephen Have An 'Act Off',2041,The Late Show with Stephen Colbert
Hu5FZYlCfc8,Very Cool Spring Break Video,15437,Gus Johnson
jYwgqUUx_7s,Mila Kunis & Kate McKinnon Play 'Speak Out',23976,TheEllenShow
10ndJuFP1PY,Jimmy Kimmel Gets a Colonoscopy with Katie Couric,12161,Jimmy Kimmel Live
YML2DM0K8DQ,Keith Urban - Coming Home (Lyric Video) ft. Julia Michaels,3411,KeithUrbanVEVO
dx9mF1KJr0s,Kelly Clarkson - I Don't Think About You [Official Video],46492,Kelly Clarkson
dRfvXL-m7O8,Who's a U.S. citizen? | Lineup | Cut,19172,Cut
BGszdLW-VqM,FULL COVERAGE?! New IT Cosmetics BYE BYE FOUNDATION [First Impression Review] 15 DAYS OF FOUNDATION,9401,thataylaa
0NWKUHl6JLY,Nintendo Switch Nindies Showcase Spring 2018,12807,Nintendo
3iUfzN4RAB8,Every Pixar Movie Reviewed in 10 Words or Less!,22008,JelloApocalypse
l_IFnDydIeQ,PRETTYMUCH Ain’t Scared Of Nick - They’ve Got Simon Cowell | Wild 'N Out | #Wildstyle,13988,MTV
4csQhMHvQWk,John Cena Gets a Prom Surprise,12471,TheEllenShow
kD-_iyS95AQ,History of TV Theme Songs with Will Smith,42172,The Tonight Show Starring Jimmy Fallon
PFH046Fh3ps,Impulse | Official Teaser Trailer - YouTube Originals,5987,Impulse
RFHH8bSdLr8,WHAT'S NEW AT SEPHORA | Hot or Not,28697,Tati
ycy30LIbq4w,Shawn Mendes Lost In Japan (Audio),355000,Shawn Mendes
ZwoDYJWWXW0,"Alan Walker, Keala Settle & The Greatest Showman Ensemble - This Is Me (Alan Walker Relift)",77032,Alan Walker
sKLREPyI-dY,FROZEN The Musical: Official Broadway Trailer,7065,Disney On Broadway
KWDUojLbxn4,i did not edit this vlog,46291,SHAYTARDS
i47zrx24dpY,Call Me By Your Name: The Influences,15951,Nerdwriter1
0oBodJHX1Vg,Stephen Works Out With Ruth Bader Ginsburg,9883,The Late Show with Stephen Colbert
-R9F2_D76TE,Scientists Have Detected the First Stars | Space Time,7468,PBS Space Time
5xvOk7fo-K8,Alexa Ruins Families | True Stories,1874,eLL cartoons
vDtyaRoonx4,GIANT ICE BLOCK Vs. TRAMPOLINE from 45m!,239153,How Ridiculous
Ud5Lq7D5YvU,Live coverage and analysis of the March for Our Lives,7107,Washington Post
nsjPEcRq_0c,CELEBRATING 1 MILLION SUBSCRIBERS AT FALLON!!,53794,Will Smith
9WFf9XY5rME,YouTubers React to Try to Watch This Without Laughing or Grinning #14,31107,REACT
FwENtwtY0EI,MASSIVE Bowl of Fruity Pebbles!! (Challenge),50370,Matt Stonie
jhEBBGOD7es,"WrestleMania's memorable returns: WWE Top 10, March 24, 2018",33003,WWE
fJZht2-Kg3w,Bill Hader Breaks Down His 9 Best Roles | GQ,9891,GQ
3nwwX-DEH1M,Why this Wagyu Sandwich is Worth $85,4931,FOOD INSIDER
bH8fQoYfZe8,Christina Aguilera Surprises Farrah Moan During Untucked: RuPaul's Drag Race Season 10,15133,WOWPresents
oLrOtjfn1rw,Jersey Shore Cast Reacts To Pauly D’s OG Casting Tape | Jersey Shore: Family Vacation | MTV,3353,MTV
wD5YzBDSXv8,Bearded Men Try Going Clean-Shaven,6561,BuzzFeedBlue
NZxVghfY6dk,Troy: Fall Of A City | Official Trailer [HD] | Netflix,3928,Netflix
eSHe32cEKqI,Everything Yolanda Hadid Eats In a Day | Food Diaries | Harper's BAZAAR,6894,Harper's BAZAAR
mhog9LEMCDY,Dem Beats (ft. RuPaul) by TODRICK HALL,36824,todrickhall
aNvRdg1lR7c,SUPERFLY - Official Teaser Trailer (HD),2328,Sony Pictures Entertainment
Ii3Rr4-Pxow,KIM KARDASHIAN: KKW Concealer Kits REVIEW ft. JAMES CHARLES!,89999,NikkieTutorials
_fjfo256p6s,Kacey Musgraves - High Horse (Lyric Video),3372,KaceyMusgravesVEVO
VVMCz04CmlA,SIDEMEN TOTAL WIPEOUT FOOTBALL CHALLENGE,110998,Sidemen
b8GGWHGkx3Y,SURPRISING HER WITH A NEW PUPPY (8 WEEKS OLD),10322,TmarTn2
EU-eQpCqBXQ,Buying Used Things,111886,Domics
CP5Ro3oy-ec,Longest Snake On Earth Eats A Deer Whole | Wildest Islands Of Indonesia,18185,Discovery UK
SONGEiVMygg,2018 Australian Grand Prix: Race Highlights,23327,FORMULA 1
hDEc4ImIVHk,Emma Gonzalez gives speech at March for Our Lives rally,11540,CNN
vGTTSdrV37U,Camila Cabello WINS Favorite Breakout Artist 🎤!! | Kids' Choice Awards 2018 | Nick,7034,Nickelodeon
MsPOzYbEUqo,Demi Lovato performs at March for our Lives,14229,WUSA9
7Tivcf-zIOU,"Lin-Manuel Miranda, Ben Platt Perform At March For Our Lives",15363,CBS Miami
w77zPAtVTuI,Bean Time-Lapse - 25 days | Soil cross section,14551,GPhase
b191evqWAwE,Game Rewind: Watch Loyola Chicago advance to their first Final Four since 1963 in 9 minutes,1524,NCAA March Madness
_rBaHuQi9gQ,My Everyday Makeup Tutorial,16418,Christen Dominique
bjG8nKYCEBQ,Sister Jean reacts to Loyola-Chicago reaching the Final Four | ESPN,2790,ESPN
OPdmg58S9ZM,Why Justin Bieber Was The Worst SNL Guest | WWHL,1354,Watch What Happens Live with Andy Cohen
G63TF6OMa_8,Living on the Most Crowded Island on Earth,13311,Great Big Story
anDIlMVgNwk,First footage of deep-sea anglerfish pair,11190,Science Magazine
zwEn-ambXLw,This Is Me - Cover by Shoshana Bean Featuring Travis Wall,4979,Shoshana Bean
DjjBg8hTaPo,How Much Food Is There On Earth?,6880,MinuteEarth
hA8lElh7LFg,ME YOU YOU ME,94762,jacksfilms
pP6r2Gy_dTs,Fried School Lunch Taste Test Ft. Harley Morenstein | TOO MUCH OF A GOOD THING,17066,Good Mythical Morning
jHZTzXteoU8,NEW MAKEUP LAUNCHES | WHATS GOOD + WHATS NOT SO GOOD,16398,KathleenLights
N0eu6U9PSbM,Slide Into Strength | Kevin Hart: What The Fit | Laugh Out Loud Network,5700,LOL Network
gaJMEgf31c4,Giant Paint Drill in 4K,26331,The Slow Mo Guys
PdbJBDNotf8,Shannon Sharpe Goes Sneaker Shopping With Complex,20319,Complex
bweX9_u7S0Y,First Take debates impact of Steph Curry and Kyrie Irving injuries on playoffs | First Take | ESPN,2666,ESPN
e9XbKS9xWD0,Charlie Puth - Change (feat. James Taylor) [Official Audio],73741,Charlie Puth
r-8NzNW6mXs,Meet the World’s Most Terrifying Caterpillar,9468,SciShow
EjW7WzozgI0,Toni Braxton - Long As I Live,43035,ToniBraxtonVEVO
MIQKlHSD89E,Tiny Donkey Thinks He's Actually A Dog  | The Dodo,50830,The Dodo
p-bGJ6W1Im4,What Would You Do for a Caramel Apple Pie?,11215,littlerobotgirl
qzLkSAVD8gA,Drew Barrymore Fact Checks Beauty Tutorials Based On Her Movies | Glamour,7659,Glamour Magazine
7BdizVgHf8I,This Week I Learned to Ski,10922,Mike Boyd
4hrrK3rXrR0,Iman Shumpert On Falling In Love w/ Teyana Taylor | Teyana & Iman | Premieres March 26th 9/8c,7529,VH1
XSg9Xc3ie_A,Rosie Huntington-Whiteley's Guide to Perfect Baby Skin | Beauty Secrets | Vogue,21120,Vogue
0EPY1CKFecs,The True Messed Up Story of Pocahontas,30214,CollegeHumor
GeF_5qo00Uw,The House with a Clock in its Walls Trailer #1 (2018) | Movieclips Trailers,6329,Movieclips Trailers
S9KxqRUcnCU,Boomerang Trick Shots | Dude Perfect,620700,Dude Perfect
2J6bJnwr1rw,Binging with Babish Reviews The Internet's Most Popular Food Videos | Bon Appétit,34832,Bon Appétit
R_O5x0LNksM,The Voice 2018 Battle - Britton Buchanan vs. Jaclyn Lovey: Thinking Out Loud,14761,The Voice
EhSXsTSNDyo,5 Seconds Of Summer - Want You Back (Official Video),215244,5SOSVEVO
nzNGEB1BQuM,FREE STUFF BEAUTY GURUS GET | Unboxing PR Packages ... Episode 11,52727,Tati
wfkZ2gXl2ak,Zach Quinto Was Busted for His Fake Starbucks Name,3118,The Late Late Show with James Corden
dikG4vMJG1s,Astronauts Answer 50 of the Most Googled Space Questions | WIRED,15590,WIRED
s9ZQ6VuoN1c,What's In My Travel Bag? | Zoella,54914,Zoella
YJ25apqV-C8,Charli XCX Transforms Into Ed Sheeran for “Shape of You” | Lip Sync Battle Preview,2666,Lip Sync Battle
uSTNyHkde08,Why isn't the world covered in poop? - Eleanor Slade and Paul Manning,13281,TED-Ed
5llHhbYjBwY,Markelle Fultz Makes His Return To The Court!,3683,NBA
Qex44E0SywU,Unbelievable Myths From The 1920s DEBUNKED!,9875,Life Noggin
J0epg1oHGbM,Send this to your crush with no context,95084,Big Marvel
u6unJQownW4,Stray Kids District 9 M/V,332748,jypentertainment
4IG0freUoog,RHOBH's Erika Jayne Works 24 Hours at Vogue,4477,Vogue
9TCdWhmtxCk,Making a Song in 57 Minutes,17650,Rob Scallon
cpxwX6KvWbQ,Ask The Riverdale Cast | Are You And Lili Reinhart Dating?,14272,Riverdale
BcruuWQ2_9Q,Worst Things About Dating a Girl,11056,MyHarto
AsTdC2RToIA,I Followed A James Charles' Makeup Tutorial,70255,LaurDIY
LC3fWTXZXxE,9 Travel Life Hacks + How to Pack for Vacation!!,70972,AlishaMarie
iz4bGGhf9Xc,REACTING TO MY LITTLE SISTERS YOUTUBE CHANNEL | MyLifeAsEva,51402,MyLifeAsEva
APASP1YKH60,Real Doctor vs TV Doctor | Medical Drama Myths | Doctor Mike,14044,Doctor Mike
r8KvT9pZs7k,Watch ‘Pacific Rim Uprising’ Destroy Sydney | Anatomy of a Scene,3317,The New York Times
6XxA-4Jp7AU,Why female condoms are so hard to find,6531,Vox
pnlNqAmCCgw,Pesto - You Suck at Cooking (episode 73),22337,You Suck At Cooking
8EiDiriAmfk,The first plant to become a venus fly trap,46612,CalebCity
paxgKBUK4wQ,Honest Trailers - Star Wars: The Last Jedi,66380,Screen Junkies
rYcnh7hXOjE,Why old buildings use the same leaf design,9354,Vox
vlrywa519No,Sean Penn's Favorite Thing About Writing: No Collaboration,3714,The Late Show with Stephen Colbert
L_SyKf-ETlY,Charlie Puth - Change (feat. James Taylor) [Official Live Performance],43031,Charlie Puth
pfM1F0fBTo8,Meet My Dog - Animated,19906,iHasCupquake
qtW9ornyPIQ,Who is Who Challenge - Merrell Twins,31165,merrelltwins
g3IvVejktJE,Kodachrome | Official Trailer [HD] | Netflix,2977,Netflix
zO0dIgvpmfw,10 Things Shawn Mendes Can't Live Without | GQ,23399,GQ
PrNRtC3XfWk,WE TRIED DIY-ING EXPENSIVE WEST ELM DECOR,8012,TheSorryGirls
OGPsw2f_HQk,Maggie Lindemann - Obsessed [Official Music Video],40671,Maggie Lindemann
NTN2gD9LJnU,LeBron James and Dwyane Wade’s Top 25 Plays As Teammates,4374,NBA
UOHURuAf5iY,Questions about Concrete Answered - The Basics,11060,Practical Engineering
mLuzmXLORSg,Working as intended,566,blayze999
RHpnWg6tdaw,Meghan Trainor Watches Fan Covers On YouTube | You Sang My Song | Glamour,13559,Glamour Magazine
b7FxPsqfkOY,How to solve 2D equations using color,11873,3Blue1Brown
sjVqDg32_8s,Westworld Season 2 | Official Trailer | HBO,27673,HBO
Ml9v3wHLuWI,Will Smith Tries Online Dating,50203,Will Smith
tl4I1b6cHKc,SURPRISING MY BIGGEST FANS AT THEIR HOUSE,46769,ElleOfTheMills
dKoIPuifJvE,The Handmaid’s Tale Season 2 Trailer (Official) • The Handmaid's Tale on Hulu,3085,Hulu
tN8o_E_f9FQ,The Darkest Minds | Official Trailer [HD] | 20th Century FOX,17620,20th Century Fox
o-BODsf2T68,Lauv - Chasing Fire [Official Audio],39161,Lauv
HxuHo62reRw,How To Make Mesmerizing Japanese Desserts,28937,Tasty
5hpuoMilm_4,73 Questions With CL | Vogue,63741,Vogue
GskBiFLSayg,Emotional Steve Smith Breaks Down During Apology,13883,ESPN UK
f743HmLmJOY,Shawn Mendes: In My Blood,64537,The Late Late Show with James Corden
sTwiDhosVks,Emily Blunt and James McAvoy Explain a Typical British Day | Vanity Fair,13518,Vanity Fair
2WHcBwq2wHc,Mo Salah bursts through wall to surprise kids | KOP KIDS PRANK,61544,Liverpool FC
JBTNG-8w5_g,Conan Plays Horse With Magic Johnson  - CONAN on TBS,15717,Team Coco
yMf3dvNzXbU,The Birth of Superman,14688,Studio C
PH3lTEhNkUk,Leslie Odom Jr. Learned The Secret To Success: Trying,1557,The Late Show with Stephen Colbert
EZXu7RxBR0Y,Pageant Queens Answer Commonly Googled Questions About Pageants,5300,BuzzFeedVideo
YZ1UN5gvLjQ,Marvel Studios' Avengers: Infinity War - All of Them TV Spot,89839,Marvel Entertainment
rrwd2_UkmNw,How To Break Your Bad Habit,23015,AsapSCIENCE
m7Ege1M5Pag,Cooking a Steak with Molten Salt,14050,The King of Random
X4Ul5vTJ-uk,Recreating The Look | Dramatic Blue smokey Eye Makeup Tutorial,13087,Denitslava Makeup
bEWLOo12UAU,Picking the 2018 XXL Freshman 10th Spot,4860,fantano
sK2RoVVxQsA,New Apple iPad 2018 hands-on,5902,The Verge
CH3aAnw7XeU,"New 2018 iPad Announced! $329, A10 Fusion & Apple Pencil",16592,EverythingApplePro
